Chapter,Section,Name,Text,IsRepealed,Details,Part
268A,1,Definitions,"Section 1. In this chapter the following words, unless a different meaning is required by the context or is specifically prescribed, shall have the following meanings:&mdash;  

(a) ''Compensation'', any money, thing of value or economic benefit conferred on or received by any person in return for services rendered or to be rendered by himself or another.  

(b) ''Competitive bidding'', all bidding, where the same may be prescribed by applicable sections of the General Laws or otherwise, given and tendered to a state, county or municipal agency in response to an open solicitation of bids from the general public by public announcement or public advertising, where the contract is awarded to the lowest responsible bidder.  

(c) ''County agency'', any department or office of county government and any division, board, bureau, commission, institution, tribunal or other instrumentality thereof or thereunder.  

(d) ''County employee'', a person performing services for or holding an office, position, employment, or membership in a county agency, whether by election, appointment, contract of hire or engagement, whether serving with or without compensation, on a full, regular, part-time, intermittent, or consultant basis.  

(e) ''Immediate family'', the employee and his spouse, and their parents, children, brothers and sisters.  

(f) ''Municipal agency'', any department or office of a city or town government and any council, division, board, bureau, commission, institution, tribunal or other instrumentality thereof or thereunder.  

(g) ''Municipal employee,'' a person performing services for or holding an office, position, employment or membership in a municipal agency, whether by election, appointment, contract of hire or engagement, whether serving with or without compensation, on a full, regular, part-time, intermittent, or consultant basis, but excluding (1) elected members of a town meeting and (2) members of a charter commission established under Article LXXXIX of the Amendments to the Constitution.  

(h) ''Official act'', any decision or action in a particular matter or in the enactment of legislation.  

(i) ''Official responsibility'', the direct administrative or operating authority, whether intermediate or final, and either exercisable alone or with others, and whether personal or through subordinates, to approve, disapprove or otherwise direct agency action.  

(j) ''Participate'', participate in agency action or in a particular matter personally and substantially as a state, county or municipal employee, through approval, disapproval, decision, recommendation, the rendering of advice, investigation or otherwise.  

(k) ''Particular matter'', any judicial or other proceeding, application, submission, request for a ruling or other determination, contract, claim, controversy, charge, accusation, arrest, decision, determination, finding, but excluding enactment of general legislation by the general court and petitions of cities, towns, counties and districts for special laws related to their governmental organizations, powers, duties, finances and property.  

(l) ''Person who has been selected'', any person who has been nominated or appointed to be a state, county or municipal employee or has been officially informed that he will be so nominated or appointed.  

(m) ''Special county employee'', a county employee who is performing services or holding an office, position, employment or membership for which no compensation is provided; or who is not an elected official and (1) occupies a position which, by its classification in the county agency involved or by the terms of the contract or conditions of employment, permits personal or private employment during normal working hours, provided that disclosure of such classification or permission is filed in writing with the State Ethics Commission and the office of the county commissioners prior to the commencement of any personal or private employment, or (2) in fact does not earn compensation as a county employee for an aggregate of more than eight hundred hours during the preceding three hundred and sixty-five days. For this purpose compensation by the day shall be considered as equivalent to compensation for seven hours per day. A special county employee shall be in such a status on days for which he is not compensated as well as on days on which he earns compensation.  

(n) ''Special municipal employee'', a municipal employee who is not a mayor, a member of the board of aldermen, a member of the city council, or a selectman in a town with a population in excess of ten thousand persons and whose position has been expressly classified by the city council, or board of aldermen if there is no city council, or board of selectmen, as that of a special employee under the terms and provisions of this chapter; provided, however, that a selectman in a town with a population of ten thousand or fewer persons shall be a special municipal employee without being expressly so classified. All employees who hold equivalent offices, positions, employment or membership in the same municipal agency shall have the same classification; provided, however, no municipal employee shall be classified as a ''special municipal employee'' unless he occupies a position for which no compensation is provided or which, by its classification in the municipal agency involved or by the terms of the contract or conditions of employment, permits personal or private employment during normal working hours, or unless he in fact does not earn compensation as a municipal employee for an aggregate of more than eight hundred hours during the preceding three hundred and sixty-five days. For this purpose compensation by the day shall be considered as equivalent to compensation for seven hours per day. A special municipal employee shall be in such status on days for which he is not compensated as well as on days on which he earns compensation. All employees of any city or town wherein no such classification has been made shall be deemed to be ''municipal employees'' and shall be subject to all the provisions of this chapter with respect thereto without exception.  

(o) ''Special state employee'', a state employee:  

(1) Who is performing services or holding an office, position, employment or membership for which no compensation is provided, or  

(2) Who is not an elected official and  

(a) occupies a position which, by its classification in the state agency involved or by the terms of the contract or conditions of employment, permits personal or private employment during normal working hours, provided that disclosure of such classification or permission is filed in writing with the state ethics commission prior to the commencement of any personal or private employment, or  

(b) in fact does not earn compensation as a state employee for an aggregate of more than eight hundred hours during the preceding three hundred and sixty-five days. For this purpose compensation by the day shall be considered as equivalent to compensation for seven hours per day. A special state employee shall be in such a status on days for which he is not compensated as well as on days on which he earns compensation.  

(p) ''State agency'', any department of state government including the executive, legislative or judicial, and all councils thereof and thereunder, and any division, board, bureau, commission, institution, tribunal or other instrumentality within such department, and any independent state authority, district, commission, instrumentality or agency, but not an agency of a county, city or town.  

(q) ''State employee'', a person performing services for or holding an office, position, employment, or membership in a state agency, whether by election, appointment, contract of hire or engagement, whether serving with or without compensation, on a full, regular, part-time, intermittent or consultant basis, including members of the general court and executive council. No construction contractor nor any of their personnel shall be deemed to be a state employee or special state employee under the provisions of paragraph (o) or this paragraph as a result of participation in the engineering and environmental analysis for major construction projects either as a consultant or part of a consultant group for the commonwealth.  Such contractors or personnel may be awarded construction contracts by the commonwealth and may continue with outstanding construction contracts with the commonwealth during the period of such participation; provided, that no such contractor or personnel shall directly or indirectly bid on or be awarded a contract for any construction project if they have participated in the engineering or environmental analysis thereof.   

",False,http://malegislature.gov/api/Chapters/268A/Sections/1/,"{'Code': 'IV', 'Details': 'http://malegislature.gov/api/Parts/IV'}"
268A,2,"Corrupt gifts, offers or promises to influence official acts; corruption of witnesses","Section 2. (a) Whoever, directly or indirectly, corruptly gives, offers or promises anything of value to any state, county or municipal employee, or to any person who has been selected to be such an employee, or to any member of the judiciary, or who offers or promises any such employee or any member of the judiciary, or any person who has been selected to be such an employee or member of the judiciary, to give anything of value to any other person or entity, with intent  

(1) to influence any official act or any act within the official responsibility of such employee or member of the judiciary or person who has been selected to be such employee or member of the judiciary, or  

(2) to influence such an employee or member of the judiciary or person who has been selected to be such an employee or member of the judiciary, to commit or aid in committing, or collude in, or allow, any fraud, or make opportunity for the commission of any fraud on the commonwealth or a state, county or municipal agency, or  

(3) to induce such an employee or member of the judiciary or person who has been selected to be such an employee or member of the judiciary to do or omit to do any act in violation of his lawful duty; or  

(b) Whoever, being a state, county or municipal employee or a member of the judiciary or a person selected to be such an employee or member of the judiciary, directly or indirectly, corruptly asks, demands, exacts, solicits, seeks, accepts, receives or agrees to receive anything of value for himself or for any other person or entity, in return for  

(1) being influenced in his performance of any official act or any act within his official responsibility, or  

(2) being influenced to commit or aid in committing, or to collude in, or allow any fraud, or make opportunity for the commission of any fraud, on the commonwealth or on a state, county or municipal agency, or  

(3) being induced to do or omit to do any acts in violation of his official duty; or  

(c) Whoever, directly or indirectly, corruptly gives, offers or promises anything of value to any person, or offers or promises such person to give anything of value to any other person or entity, with intent to influence the testimony under oath or affirmation of such first-mentioned person or any other person as a witness upon a trial, or other proceeding, before any court, any committee of either house or both houses of the general court, or any agency, commission or officer authorized by the laws of the commonwealth to hear evidence or take testimony, or with intent to influence such witness to absent himself therefrom; or  

(d) Whoever, directly or indirectly, corruptly asks, demands, exacts, solicits, seeks, accepts, receives or agrees to receive anything of value for himself or for any other person or entity in return for influence upon the testimony under oath or affirmation of himself or any other person as a witness upon any such trial, hearing or other proceeding or in return for the absence of himself or any other person therefrom;&mdash;shall be punished by a fine of not more than $100,000, or by imprisonment in the state prison for not more than 10 years, or in a jail or house of correction for not more than 21/2 years, or both; and in the event of final conviction shall be incapable of holding any office of honor, trust or profit under the commonwealth or under any state, county or municipal agency.  

Clauses (c) and (d) shall not be construed to prohibit the payment or receipt of witness fees provided by law or the payment by the party upon whose behalf a witness is called and receipt by a witness of the reasonable cost of travel and subsistence incurred and the reasonable value of time lost in attendance at any such trial, hearing or proceeding, or, in the case of expert witnesses, involving a technical or professional opinion, a reasonable fee for time spent in the preparation of such opinion, in appearing or testifying.   

",False,http://malegislature.gov/api/Chapters/268A/Sections/2/,"{'Code': 'IV', 'Details': 'http://malegislature.gov/api/Parts/IV'}"
268A,3,"Gifts, offers or promises for acts performed or to be performed; corruption of witnesses; solicitation of gifts; witness fees; regulations","Section 3. (a) Whoever knowingly, otherwise than as provided by law for the proper discharge of official duty, directly or indirectly, gives, offers or promises anything of substantial value to any present or former state, county or municipal employee or to any member of the judiciary, or to any person selected to be such an employee or member of the judiciary: (i) for or because of any official act performed or to be performed by such an employee or member of the judiciary or person selected to be such an employee or member of the judiciary; or (ii) to influence, or attempt to influence, an official action of the state, county or municipal employee or to any member of the judiciary; or  

(b) Whoever knowingly, being a present or former state, county or municipal employee or member of the judiciary, or person selected to be such an employee or member of the judiciary, otherwise than as provided by law for the proper discharge of official duty, directly or indirectly, asks, demands, exacts, solicits, seeks, accepts, receives or agrees to receive anything of substantial value: (i) for himself for or because of any official act or act within his official responsibility performed or to be performed by him; or (ii) to influence, or attempt to influence, him in an official act taken; or  

(c) Whoever knowingly, directly or indirectly, gives, offers or promises anything of substantial value to any person, for or because of testimony under oath or affirmation given or to be given by such person or any other person as a witness upon a trial, hearing or other proceeding, before any court, any committee of either house or both houses of the general court, or any agency, commission or officer authorized by the laws of the commonwealth to hear evidence or take testimony or for or because of his absence therefrom; or  

(d) Whoever knowingly, directly or indirectly, asks, demands, exacts, solicits, seeks, accepts, receives or agrees to receive anything of substantial value for himself for or because of the testimony under oath or affirmation given or to be given by him or any other person as a witness upon any such trial, hearing or other proceeding, or for or because of his absence therefrom; shall be punished by a fine of not more than $50,000, or by imprisonment in the state prison for not more than 5 years, or in a jail or house of correction for not more than 2 1/2 years, or both.  

(e) Clauses (c) and (d) shall not prohibit the payment or receipt of witness fees provided by law or the payment by the party upon whose behalf a witness is called and receipt by a witness of the reasonable cost of travel and subsistence incurred and the reasonable value of time lost in attendance at any such trial, hearing or proceeding, or, in the case of expert witnesses, involving a technical or professional opinion, a reasonable fee for time spent in the preparation of such opinion, in appearing or testifying.  

(f) The state ethics commission shall adopt regulations: (i) defining ''substantial value,''; provided, however, that ''substantial value'' shall not be less than $50; (ii) establishing exclusions for ceremonial gifts; (iii) establishing exclusions for gifts given solely because of family or friendship; and (iv) establishing additional exclusions for other situations that do not present a genuine risk of a conflict or the appearance of a conflict of interest.   

",False,http://malegislature.gov/api/Chapters/268A/Sections/3/,"{'Code': 'IV', 'Details': 'http://malegislature.gov/api/Parts/IV'}"
268A,4,"Other compensation; offer, gift, receipt or request; acting as agent or attorney for other than state; legislators; special state employees","Section 4. (a) No state employee shall otherwise than as provided by law for the proper discharge of official duties, directly or indirectly receive or request compensation from anyone other than the commonwealth or a state agency, in relation to any particular matter in which the commonwealth or a state agency is a party or has a direct and substantial interest.  

(b) No person shall knowingly, otherwise than as provided by law for the proper discharge of official duties, directly or indirectly give, promise or offer such compensation.  

(c) No state employee shall, otherwise than in the proper discharge of his official duties, act as agent or attorney for anyone other than the commonwealth or a state agency for prosecuting any claim against the commonwealth or a state agency, or as agent or attorney for anyone in connection with any particular matter in which the commonwealth or a state agency is a party or has a direct and substantial interest.  

Whoever violates any provision of this section shall be punished by a fine of not more than $10,000, or by imprisonment in the state prison for not more than 5 years, or in a jail or house of correction for not more than 2 1/2 years, or both.  

Neither a member of the general court nor a member of the executive council shall be subject to paragraphs (a) or (c). However, no member of the general court or executive council shall personally appear for any compensation other than his legislative or executive council salary before any state agency, unless:  

(1) the particular matter before the state agency is ministerial in nature; or  

(2) the appearance is before a court of the commonwealth; or  

(3) the appearance is in a quasi-judicial proceeding.  

For the purposes of this paragraph, ministerial functions include, but are not limited to, the filing or amendment of: tax returns, applications for permits or licenses, incorporation papers, or other documents. For the purposes of this paragraph, a proceeding shall be considered quasi-judicial if:  

(1) the action of the state agency is adjudicatory in nature; and  

(2) the action of the state agency in appealable to the courts; and  

(3) both sides are entitled to representation by counsel and such counsel is neither the attorney general nor the counsel for the state agency conducting the proceeding.  

A special state employee shall be subject to paragraphs (a) and (c) only in relation to a particular matter (a) in which he has at any time participated as a state employee, or (b) which is or within one year has been a subject of his official responsibility, or (c) which is pending in the state agency in which he is serving. Clause (c) of the preceding sentence shall not apply in the case of a special state employee who serves on no more than sixty days during any period of three hundred and sixty-five consecutive days.  

This section shall not prevent a state employee from taking uncompensated action, not inconsistent with the faithful performance of his duties, to aid or assist any person who is the subject of disciplinary or other personnel administration proceedings with respect to those proceedings.  

This section shall not prevent a state employee, including a special employee, from acting, with or without compensation, as agent or attorney for or otherwise aiding or assisting members of his immediate family or any person for whom he is serving as guardian, executor, administrator, trustee or other personal fiduciary except in those matters in which he has participated or which are the subject of his official responsibility; provided, that the state official responsible for appointment to his position approves.  

This section shall not prevent a present or former special state employee from aiding or assisting another person for compensation in the performance of work under a contract with or for the benefit of the commonwealth; provided, that the head of the special state employee's department or agency has certified in writing that the interest of the commonwealth requires such aid or assistance and the certification has been filed with the state ethics commission.  

This section shall not prevent a state employee from giving testimony under oath or making statements required to be made under penalty for perjury or contempt.  

This section shall not prohibit a state employee from holding an elective or appointive office in a city, town or district, nor in any way prohibit such an employee from performing the duties of or receiving the compensation provided for such office. No such elected or appointed official may vote or act on any matter which is within the purview of the agency by which he is employed or over which such employee has official responsibility.  

This section shall not prevent a state employee, other than an employee in the department of revenue, from requesting or receiving compensation from anyone other than the commonwealth in relation to the filing or amending of state tax returns.   

",False,http://malegislature.gov/api/Chapters/268A/Sections/4/,"{'Code': 'IV', 'Details': 'http://malegislature.gov/api/Parts/IV'}"
