Chapter,Section,Name,Text,IsRepealed,Details,Part
268A,12,Former county employees; acting as attorney or receiving compensation from other than county; partners of employees or former employees or legislators,"Section 12. (a) A former county employee who knowingly acts as agent or attorney for or receives compensation directly or indirectly from anyone other than a county or a county agency in connection with any particular matter in which the county or a county agency of the same county is a party or has a direct and substantial interest and in which he participated as a county employee while so employed, or  

(b) A former county employee who, within one year after his last employment has ceased, appears personally before any agency of the county as agent or attorney for anyone other than the county in connection with any particular matter in which the county or a county agency of the same county is a party or has a direct and substantial interest and which was under his official responsibility as a county employee at any time within a period of two years prior to the termination of his employment, or  

(c) A partner of a former county employee who knowingly engages, during a period of one year following the termination of the latter's employment by the county, in any activity in which the former county employee is himself prohibited from engaging by clause (a), or  

(d) A partner of a county employee who knowingly acts as agent or attorney for anyone other than the county in connection with any particular matter in which the county or a county agency of the same county is a party or has a direct and substantial interest and in which the county employee participates or has participated as a county employee or which is the subject of his official responsibility, shall be punished by a fine of not more than $10,000, or by imprisonment in the state prison for not more than 5 years, or in a jail or house of correction for not more than 2 1/2 years, or both.  

If a partner of a special county employee or of a former county employee is also a member of another partnership in which the special or former employee has no interest, activities of the latter partnership in which the special or former employee takes no part shall not thereby be subject to clause (c) or (d).  

This section shall not prevent a present or former special county employee from aiding or assisting another person for compensation in the performance of work under a contract with or for the benefit of the county; provided, that the head of the special county employee's department or agency has certified in writing that the interest of the county requires such aid or assistance and the certification has been filed with the state ethics commission. The certification shall be open to public inspection.   

",False,http://malegislature.gov/api/Chapters/268A/Sections/12/,"{'Code': 'IV', 'Details': 'http://malegislature.gov/api/Parts/IV'}"
268A,13,"Financial interest of county employee, relatives or associates; disclosure","Section 13. (a) Except as permitted by paragraph (b), a county employee who participates as such an employee in a particular matter in which to his knowledge he, his immediate family or partner, a business organization which he is serving as officer, director, trustee, partner or employee, or any person or organization with whom he is negotiating or has any arrangement concerning prospective employment, has a financial interest, shall be punished by a fine of not more than $10,000, or by imprisonment in the state prison for not more than 5 years, or in a jail or house of correction for not more than 2 1/2 years, or both.  

(b) Any county employee whose duties would otherwise require him to participate in such a particular matter shall advise the official responsible for appointment to his position and the state ethics commission of the nature and circumstances of the particular matter and make full disclosure of such financial interest, and the appointing official shall thereupon either  

(1) assign the particular matter to another employee; or  

(2) assume responsibility for the particular matter; or  

(3) make a written determination that the interest is not so substantial as to be deemed likely to affect the integrity of the services which the county may expect from the employee, in which case it shall not be a violation for the employee to participate in the particular matter. Copies of such written determination shall be forwarded to the county employee and filed with the state ethics commission by the person who made the determination. Such copy shall be retained by the commission for a period of six years.   

",False,http://malegislature.gov/api/Chapters/268A/Sections/13/,"{'Code': 'IV', 'Details': 'http://malegislature.gov/api/Parts/IV'}"
268A,14,County employees; financial interest in contracts of county agency,"Section 14. A county employee who has a financial interest, directly or indirectly, in a contract made by a county agency of the same county, in which the county or a county agency is an interested party of which financial interest he has knowledge or has reason to know, shall be punished by a fine of not more than $10,000, or by imprisonment in the state prison for not more than 5 years, or in a jail or house of correction for not more than 2 1/2 years, or both.  

This section shall not apply if such financial interest consists of the ownership of less than one per cent of the stock of a corporation.  

This section shall not apply (a) to a county employee who in good faith and within thirty days after he learns of an actual or prospective violation of this section makes full disclosure of his financial interest to the contracting agency and terminates or disposes of the interest, or (b) to a county employee who does not participate in or have official responsibility for any of the activities of the contracting agency, if the contract is made through competitive bidding and his direct and indirect interests and those of his immediate family in the corporation or other commercial entity with which the contract is made do not in the aggregate amount to ten per cent of the total proprietary interests therein, or (c) to a special county employee who does not participate in or have official responsibility for any of the activities of the contracting agency and who files with the state ethics commission a statement making full disclosure of his interest and the interests of his immediate family in the contract, if the county commissioners approve the exemption of his interest from this section.   

",False,http://malegislature.gov/api/Chapters/268A/Sections/14/,"{'Code': 'IV', 'Details': 'http://malegislature.gov/api/Parts/IV'}"
268A,15,"Avoiding, rescinding or canceling county agency actions resulting from violations of chapter; restitution and damages","Section 15. (a) In addition to any other remedies provided by law, a violation of section 2, 3, 8, or sections 11 to 14, inclusive, or section 23 which has substantially influenced the action taken by any county agency in any particular matter, shall be grounds for avoiding, rescinding, or canceling the action on such terms as the interests of the county and innocent third persons shall require.  

(b) In addition to the remedies set forth in subsection (a), the commission may, upon a finding pursuant to an adjudicatory proceeding that a person has acted to his economic advantage in violation of section 2, 3, 8, sections 11 to 14, inclusive, or section 23, issue an order (1) requiring the violator to pay the commission on behalf of the county damages in the amount of the economic advantage or $500, whichever is greater; and (2) requiring the violator to make restitution to an injured third party. If there has been no final criminal judgment of conviction or acquittal of the same violation, upon receipt of the written approval of the attorney general and the district attorney, the commission may order payment of additional damages in an amount not exceeding twice the amount of the economic advantage or $500, and payment of such additional damages shall bar any criminal prosecution for the same violation.  

The maximum damages that the commission may order a violator to pay under this section shall be $25,000. If the commission determines that the damages authorized by this section exceed $25,000, it may bring a civil action against the violator to recover such damages.  

(c) The remedies authorized by this section shall be in addition to any civil penalty imposed by the commission in accordance with clause (3) of subsection (j) of section 4 of chapter 268B.   

",False,http://malegislature.gov/api/Chapters/268A/Sections/15/,"{'Code': 'IV', 'Details': 'http://malegislature.gov/api/Parts/IV'}"
268A,15A,Members of county commission or board; restrictions on appointments to certain positions,"Section 15A. No member of a county commission or board shall be eligible for appointment or election by the members of such commission or board to any office or position under the supervision of such commission or board. No former member of such commission or board shall be so eligible until the expiration of thirty days from the termination of his service as a member of such commission or board.   

",False,http://malegislature.gov/api/Chapters/268A/Sections/15A/,"{'Code': 'IV', 'Details': 'http://malegislature.gov/api/Parts/IV'}"
268A,16,nan,nan,False,http://malegislature.gov/api/Chapters/268A/Sections/16/,nan
268A,17,Municipal employees; gift or receipt of compensation from other than municipality; acting as agent or attorney,"Section 17. (a) No municipal employee shall, otherwise than as provided by law for the proper discharge of official duties, directly or indirectly receive or request compensation from anyone other than the city or town or municipal agency in relation to any particular matter in which the same city or town is a party or has a direct and substantial interest.  

(b) No person shall knowingly, otherwise than as provided by law for the proper discharge of official duties, directly or indirectly give, promise or offer such compensation.  

(c) No municipal employee shall, otherwise than in the proper discharge of his official duties, act as agent or attorney for anyone other than the city or town or municipal agency in prosecuting any claim against the same city or town, or as agent or attorney for anyone in connection with any particular matter in which the same city or town is a party or has a direct and substantial interest.  

Whoever violates any provision of this section shall be punished by a fine of not more than $10,000, or by imprisonment in the state prison for not more than 5 years, or in a jail or house of correction for not more than 2 1/2 years, or both.  

A special municipal employee shall be subject to paragraphs (a) and (c) only in relation to a particular matter (a) in which he has at any time participated as a municipal employee, or (b) which is or within one year has been a subject of his official responsibility, or (c) which is pending in the municipal agency in which he is serving. Clause (c) of the preceding sentence shall not apply in the case of a special municipal employee who serves on no more than sixty days during any period of three hundred and sixty-five consecutive days.  

This section shall not prevent a municipal employee from taking uncompensated action, not inconsistent with the faithful performance of his duties, to aid or assist any person who is the subject of disciplinary or other personnel administration proceedings with respect to those proceedings.  

This section shall not prevent a municipal employee, including a special employee, from acting, with or without compensation, as agent or attorney for or otherwise aiding or assisting members of his immediate family or any person for whom he is serving as guardian, executor, administrator, trustee or other personal fiduciary except in those matters in which he has participated or which are the subject of his official responsibility; provided, that the official responsible for appointment to his position approves.  

This section shall not prevent a present or former special municipal employee from aiding or assisting another person for compensation in the performance of work under a contract with or for the benefit of the city or town; provided, that the head of the special municipal employee's department or agency has certified in writing that the interest of the city or town requires such aid or assistance and the certification has been filed with the clerk of the city or town. The certification shall be open to public inspection.  

This section shall not prevent a municipal employee from giving testimony under oath or making statements required to be made under penalty for perjury or contempt.  

This section shall not prevent a municipal employee from applying on behalf of anyone for a building, electrical, wiring, plumbing, gas fitting or septic system permit, nor from receiving compensation in relation to any such permit, unless such employee is employed by or provides services to the permit-granting agency or an agency that regulates the activities of the permit-granting agency.   

",False,http://malegislature.gov/api/Chapters/268A/Sections/17/,"{'Code': 'IV', 'Details': 'http://malegislature.gov/api/Parts/IV'}"
268A,18,Former municipal employee; acting as attorney or receiving compensation; from other than municipality; partners,"Section 18. (a) A former municipal employee who knowingly acts as agent or attorney for or receives compensation, directly or indirectly from anyone other than the same city or town in connection with any particular matter in which the city or town is a party or has a direct and substantial interest and in which he participated as a municipal employee while so employed, or (b) a former municipal employee who, within one year after his last employment has ceased, appears personally before any agency of the city or town as agent or attorney for anyone other than the city or town in connection with any particular matter in which the same city or town is a party or has a direct and substantial interest and which was under his official responsibility as a municipal employee at any time within a period of two years prior to the termination of his employment, or (c) a partner of a former municipal employee who knowingly engages, during a period of one year following the termination of the latter's employment by the city or town, in any activity in which the former municipal employee is himself prohibited from engaging by clause (a), or (d) a partner of a municipal employee who knowingly acts as agent or attorney for anyone other than the city or town in connection with any particular matter in which the same city or town is a party or has a direct and substantial interest and in which the municipal employee participates or has participated as a municipal employee or which is the subject of his official responsibility, shall be punished by a fine of not more than $10,000, or by imprisonment in the state prison for not more than 5 years, or in a jail or house of correction for not more than 2 1/2 years, or both.  

If a partner of a former municipal employee or of a special municipal employee is also a member of another partnership in which the former or special employee has no interest, the activities of the latter partnership in which the former or special employee takes no part shall not thereby be subject to clause (c) or (d).  

Notwithstanding the provisions of clause (b), a former town counsel who acted in such capacity on a salary or retainer of less than two thousand dollars per year shall be prohibited from appearing personally before any agency of the city or town as agent or attorney for anyone other than the city or town only in connection with any particular matter in which the same city or town is a party or has a direct and substantial interest and in which he participated while so employed.  

This section shall not prevent a present or former special municipal employee from aiding or assisting another person for compensation in the performance of work under a contract with or for the benefit of the city or town; provided, that the head of the special municipal employee's department or agency has certified in writing that the interest of the city or town requires such aid or assistance and the certification has been filed with the clerk of the city or town. The certification shall be open to public inspection.   

",False,http://malegislature.gov/api/Chapters/268A/Sections/18/,"{'Code': 'IV', 'Details': 'http://malegislature.gov/api/Parts/IV'}"
268A,19,"Municipal employees, relatives or associates; financial interest in particular matter","Section 19. (a) Except as permitted by paragraph (b), a municipal employee who participates as such an employee in a particular matter in which to his knowledge he, his immediate family or partner, a business organization in which he is serving as officer, director, trustee, partner or employee, or any person or organization with whom he is negotiating or has any arrangement concerning prospective employment, has a financial interest, shall be punished by a fine of not more than $10,000, or by imprisonment in the state prison for not more than 5 years, or in a jail or house of correction for not more than 2 1/2 years, or both.  

(b) It shall not be a violation of this section (1) if the municipal employee first advises the official responsible for appointment to his position of the nature and circumstances of the particular matter and makes full disclosure of such financial interest, and receives in advance a written determination made by that official that the interest is not so substantial as to be deemed likely to affect the integrity of the services which the municipality may expect from the employee, or (2) if, in the case of an elected municipal official making demand bank deposits of municipal funds, said official first files, with the clerk of the city or town, a statement making full disclosure of such financial interest, or (3) if the particular matter involves a determination of general policy and the interest of the municipal employee or members of his immediate family is shared with a substantial segment of the population of the municipality.   

",False,http://malegislature.gov/api/Chapters/268A/Sections/19/,"{'Code': 'IV', 'Details': 'http://malegislature.gov/api/Parts/IV'}"
