Chapter,Section,Name,Text,IsRepealed,Details,Part
268A,5,Former state employees; acting as agent or attorney or receiving compensation; partners of state employees or legislators,"Section 5. (a) A former state employee who knowingly acts as agent or attorney for, or receives compensation directly or indirectly from anyone other than the commonwealth or a state agency, in connection with any particular matter in which the commonwealth or a state agency is a party or has a direct and substantial interest and in which he participated as a state employee while so employed, or  

(b) a former state employee who, within one year after his last employment has ceased, appears personally before any court or agency of the commonwealth as agent or attorney for anyone other than the commonwealth in connection with any particular matter in which the commonwealth or a state agency is a party or has a direct and substantial interest and which was under his official responsibility as a state employee at any time within a period of two years prior to the termination of his employment, or  

(b1/2) A former state, county or municipal employee who participated as such in general legislation on expanded gaming in the commonwealth or in the implementation, administration or enforcement of chapter 23K, and who becomes an officer or employee of, or who acquires a financial interest in, an applicant for a gaming license or a gaming licensee under said chapter 23K within one year after his last state, county or municipal employment has ceased, or  

(c) a partner of a former state employee who knowingly engages, during a period of one year following the termination of the latter's employment by the commonwealth, in any activity in which the former state employee is himself prohibited from engaging in by clause (a), or  

(d) a partner of a state employee who knowingly acts as agent or attorney for anyone other than the commonwealth in connection with any particular matter in which the commonwealth or a state agency is a party or has a direct and substantial interest and in which the state employee participates or has participated as a state employee or which is the subject of his official responsibility, or  

(e) a former state employee or elected official, including a former member of the general court, who acts as legislative or executive agent, as defined in section thirty-nine of chapter three, for anyone other than the commonwealth or a state agency before the governmental body, as determined by the state ethics commission with which he has been associated, within one year after he leaves that body or  

(f) a former state employee whose salary was not less than that in step one of job group M&ndash;VII in the management salary schedule in section forty-six C of chapter thirty, and who becomes an officer or employee of a business organization which is or was a party to any privatization contract as defined in section fifty-three of chapter seven in which contract he participated as such state employee, if he becomes such officer or employee while the business organization is such a party or within one year after he terminates his state employment, unless before the termination of his state employment the governor determines, in a writing filed with the state ethics commission, that such participation did not significantly affect the terms or implementation of such contract, shall be punished by a fine of not more than $10,000, or by imprisonment in the state prison for not more than 5 years, or in a jail or house of correction for not more than 2 1/2 years, or both.  

If a partner of a member of the general court or of a special state employee or of a former state employee is also a member of another partnership in which the member of the general court or special or former employee has no interest, the activities of the latter partnership in which the member of the general court or special or former employee takes no part shall not thereby be subject to clause (c) or (d).  

This section shall not prevent a present or former special state employee from aiding or assisting another person for compensation in the performance of work under a contract with or for the benefit of the commonwealth; provided, that the head of the special state employee's department or agency has certified in writing that the interest of the commonwealth requires such aid or assistance and the certification has been filed with the state ethics commission.   

",False,http://malegislature.gov/api/Chapters/268A/Sections/5/,"{'Code': 'IV', 'Details': 'http://malegislature.gov/api/Parts/IV'}"
268A,6,"Financial interest of state employee, relative or associates; disclosure","Section 6. (a) Except as permitted by this section, any state employee who participates as such employee in a particular matter in which to his knowledge he, his immediate family or partner, a business organization in which he is serving as officer, director, trustee, partner or employee, or any person or organization with whom he is negotiating or has any arrangement concerning prospective employment, has a financial interest, shall be punished by a fine of not more than $10,000, or by imprisonment in the state prison for not more than 5 years, or in a jail or house of correction for not more than 2 1/2 years, or both.  

Any state employee whose duties would otherwise require him to participate in such a particular matter shall advise the official responsible for appointment to his position and the state ethics commission of the nature and circumstances of the particular matter and make full disclosure of such financial interest, and the appointing official shall thereupon either  

(1) assign the particular matter to another employee; or  

(2) assume responsibility for the particular matter; or  

(3) make a written determination that the interest is not so substantial as to be deemed likely to affect the integrity of the services which the commonwealth may expect from the employee, in which case it shall not be a violation for the employee to participate in the particular matter. Copies of such written determination shall be forwarded to the state employee and filed with the state ethics commission by the person who made the determination.  Such copy shall be retained by the commission for a period of six years.  

[There is no subsection (b).]   

",False,http://malegislature.gov/api/Chapters/268A/Sections/6/,"{'Code': 'IV', 'Details': 'http://malegislature.gov/api/Parts/IV'}"
268A,6A,Conflict of interest of public official; reporting requirement,"Section 6A. Any public official, as defined by section one of chapter two hundred and sixty-eight B, who in the discharge of his official duties would be required knowingly to take an action which would substantially affect such official's financial interests, unless the effect on such an official is no greater than the effect on the general public, shall file a written description of the required action and the potential conflict of interest with the state ethics commission established by said chapter two hundred and sixty-eight B.   

",False,http://malegislature.gov/api/Chapters/268A/Sections/6A/,"{'Code': 'IV', 'Details': 'http://malegislature.gov/api/Parts/IV'}"
268A,6B,Candidates for employment as state employee; disclosure of relation to state employee,"Section 6B. Each candidate for employment as a state employee shall be required by the hiring authority as part of the application process to disclose, in writing, the names of any state employee who is related to the candidate as: spouse, parent, child or sibling or the spouse of the candidate's parent, child or sibling.  

The contents of a disclosure received under this section from an employee when such employee was a candidate shall be considered public records under section 7 of chapter 4 and chapter 66.  

All disclosures made by applicants hired by a state agency shall be made available for public inspection to the extent permissible by law by the official with whom such disclosure has been filed.   

",False,http://malegislature.gov/api/Chapters/268A/Sections/6B/,"{'Code': 'IV', 'Details': 'http://malegislature.gov/api/Parts/IV'}"
268A,7,Financial interest in contracts of state agency; application of section,"Section 7. A state employee who has a financial interest, directly or indirectly, in a contract made by a state agency, in which the commonwealth or a state agency is an interested party, of which interest he has knowledge or has reason to know, shall be punished by a fine of not more than $10,000, or by imprisonment in the state prison for not more than 5 years, or in a jail or house of correction for not more than 2 1/2 years, or both.  

This section shall not apply if such financial interest consists of the ownership of less than one per cent of the stock of a corporation.  

This section shall not apply (a) to a state employee who in good faith and within thirty days after he learns of an actual or prospective violation of this section makes full disclosure of his financial interest to the contracting agency and terminates or disposes of the interest, or (b) to a state employee other than a member of the general court who is not employed by the contracting agency or an agency which regulates the activities of the contracting agency and who does not participate in or have official responsibility for any of the activities of the contracting agency, if the contract is made after public notice or where applicable, through competitive bidding, and if the state employee files with the state ethics commission a statement making full disclosure of his interest and the interests of his immediate family in the contract, and if in the case of a contract for personal services (1) the services will be provided outside the normal working hours of the state employee, (2) the services are not required as part of the state employee's regular duties, the employee is compensated for not more than five hundred hours during a calendar year, and (3) the head of the contracting agency makes and files with the state ethics commission a written certification that no employee of that agency is available to perform those services as a part of their regular duties, or (c) to the interest of a member of the general court in a contract made by an agency other than the general court or either branch thereof, if his direct and indirect interests and those of his immediate family in the corporation or other commercial entity with which the contract is made do not in the aggregate amount to ten per cent of the total proprietary interests therein, and the contract is made through competitive bidding and he files with the state ethics commission a statement making full disclosure of his interest and the interests of his immediate family or (d) to a special state employee who does not participate in or have official responsibility for any of the activities of the contracting agency and who files with the state ethics commission a statement making full disclosure of his interest and the interests of his immediate family in the contract, or (e) to a special state employee who files with the state ethics commission a statement making full disclosure of his interest and the interests of his immediate family in the contract, if the governor with the advice and consent of the executive council exempts him.  

This section shall not apply to a state employee who provides services or furnishes supplies, goods and materials to a recipient of public assistance, provided that such services or such supplies, goods and materials are provided in accordance with a schedule of charges promulgated by the department of transitional assistance or the division of health care policy and finance and provided, further, that such recipient has the right under law to choose and in fact does choose the person or firm that will provide such services or furnish such supplies, goods and materials.  

This section shall not prohibit a state employee from teaching or performing other related duties in an educational institution of the commonwealth; provided, that such employee does not participate in, or have official responsibility for, the financial management of such educational institution; and provided, further, that such employee is so employed on a part-time basis. Such employee may be compensated for such services, notwithstanding the provisions of section twenty-one of chapter thirty.  

This section shall not prohibit a state employee from being employed on a part-time basis by a facility operated or designed for the care of mentally ill or mentally retarded persons, public health, correctional facility or any other facility principally funded by the state which provides similar services and which operates on an uninterrupted and continuous basis; provided that such employee does not participate in, or have official responsibility for, the financial management of such facility, that he is compensated for such part-time employment for not more than four hours in any day in which he is otherwise compensated by the commonwealth, and at a rate which does not exceed that of a state employee classified in step one of job group XX of the general salary schedule contained in section forty-six of chapter thirty, and that the head of the facility makes and files with the state ethics commission a written certification that there is a critical need for the services of the employee. Such employee may be compensated for such services, notwithstanding the provisions of section twenty-one of chapter thirty.  

This section shall not preclude an officer or employee of the Massachusetts Port Authority from eligibility for any residential sound insulation program or the bayswater environmental program provided that the officer or employee has no responsibility for the administration for that program from which he is to receive the benefit.   

",False,http://malegislature.gov/api/Chapters/268A/Sections/7/,"{'Code': 'IV', 'Details': 'http://malegislature.gov/api/Parts/IV'}"
268A,8,Public building or construction contracts,"Section 8. No state, county or municipal employee and no person acting or purporting to act on behalf of such employee, or any state, county or municipal agency, shall with respect to any public building or construction contract which is about to be or which has been competitively bid, require the bidder to make application to or furnish financial data to, or to obtain, or procure, any of the surety bonds or insurance specified in connection with such contract or specified by any law from any particular insurance or surety company, agent, or broker. This section shall not prevent the exercise by such employee on behalf of a state, county, or municipal agency of its right to approve the form, sufficiency, or manner of execution of the surety bonds and insurance furnished by the insurance or surety company selected by the bidder to underwrite said insurance and bonds. Any provisions in any invitation for bids, or in any of the contract documents, in conflict with this section are hereby declared to be contrary to the public policy of this commonwealth. Whoever violates any provision of this section shall be punished by a fine of not more than $10,000, or by imprisonment in the state prison for not more than 5 years, or in a jail or house of correction for not more than 2 1/2 years, or both.   

",False,http://malegislature.gov/api/Chapters/268A/Sections/8/,"{'Code': 'IV', 'Details': 'http://malegislature.gov/api/Parts/IV'}"
268A,8A,Members of state commissions or boards; prohibited appointments to other positions,"Section 8A. No member of a state commission or board shall be eligible for appointment or election by the members of such commission or board to any office or position under the supervision of such commission or board. No former member of such commission or board shall be so eligible until the expiration of thirty days from the termination of his service as a member of such commission or board.   

",False,http://malegislature.gov/api/Chapters/268A/Sections/8A/,"{'Code': 'IV', 'Details': 'http://malegislature.gov/api/Parts/IV'}"
268A,8B,Members of commonwealth utilities commission; prohibited lobbying activities,"Section 8B. No member of the commonwealth utilities commission, appointed pursuant to section 2 of chapter 25, or the commissioner of telecommunications and cable shall, within one year after his service has ceased or terminated on said commission, be employed by, or lobby said commission on behalf of, any company or regulated industry over which said commission had jurisdiction during the tenure of such member of the commission.   

",False,http://malegislature.gov/api/Chapters/268A/Sections/8B/,"{'Code': 'IV', 'Details': 'http://malegislature.gov/api/Parts/IV'}"
268A,9,"Avoiding, rescinding or canceling state agency actions resulting from violations of chapter; restitution and damages","Section 9. (a) In addition to any other remedies provided by law, any violation of sections 2 to 8, inclusive, or section 23 which has substantially influenced the action taken by any state agency in any particular matter, shall be grounds for avoiding, rescinding or canceling the action on such terms as the interests of the commonwealth and innocent third persons shall require.  

(b) In addition to the remedies set forth in subsection (a), the state ethics commission upon a finding pursuant to an adjudicatory proceeding that a person has acted to his economic advantage in violation of sections 2 to 8, inclusive, or section 23, may issue an order: (1) requiring the violator to pay the commission on behalf of the commonwealth damages in the amount of the economic advantage or $500, whichever is greater; and (2) requiring the violator to make restitution to an injured third party. If there has been no final criminal judgment of conviction or acquittal of the same violation, upon receipt of the written approval of the attorney general, the commission may order payment of additional damages in an amount not exceeding twice the amount of the economic advantage or $500, and payment of such additional damages shall bar any criminal prosecution for the same violation.  

The maximum damages that the commission may order a violator to pay under this section shall be $25,000. If the commission determines that the damages authorized by this section exceed $25,000, it may bring a civil action against the violator to recover such damages.  

(c) The remedies authorized by this section shall be in addition to any civil penalty imposed by the state ethics commission in accordance with clause (3) of subsection (j) of section 4 of chapter 268B.   

",False,http://malegislature.gov/api/Chapters/268A/Sections/9/,"{'Code': 'IV', 'Details': 'http://malegislature.gov/api/Parts/IV'}"
268A,10,Opinions of state ethics commission,"Section 10. The state ethics commission shall issue opinions interpreting the requirements of this chapter in accordance with clause (g) of section three of chapter two hundred and sixty-eight B.   

",False,http://malegislature.gov/api/Chapters/268A/Sections/10/,"{'Code': 'IV', 'Details': 'http://malegislature.gov/api/Parts/IV'}"
268A,11,"County employees; receiving or requesting compensation from, or acting as agent or attorney for other than county agency","Section 11. (a) No county employee shall, otherwise than as provided for the proper discharge of official duties, directly or indirectly receive or request compensation from anyone other than a county or a county agency in relation to any particular matter in which a county agency is a party or has a direct and substantial interest.  

(b) No person shall knowingly, otherwise than as provided by law for the proper discharge of official duties, directly or indirectly give, promise or offer such compensation.  

(c) No county employee shall, otherwise than as provided by law for the proper discharge of official duties, act as agent or attorney for anyone other than a county or a county agency in prosecuting any claim against a county or county agency, or as agent or attorney for anyone in connection with any particular matter in which a county or county agency is a party or has a direct and substantial interest.  

Whoever violates any provision of this section shall be punished by a fine of not more than $10,000, or by imprisonment in the state prison for not more than 5 years, or in a jail or house of correction for not more than 21/2 years, or both.  

A county employee shall be subject to paragraphs (a) and (c) only in relation to the county of which he is an employee. A special county employee shall be subject to said paragraphs (a) and (c) only in relation to a particular matter (a) in which he has at any time participated as a county employee, or (b) which is or within one year has been a subject of his official responsibility, or (c) which is pending in the county agency in which he is serving. Clause (c) of the preceding sentence shall not apply in the case of a county employee who serves on no more than sixty days during any period of three hundred and sixty-five consecutive days.  

This section shall not prevent a county employee from taking uncompensated action, not inconsistent with the faithful performance of his duties, to aid or assist any person who is the subject of disciplinary or other personnel administration proceedings with respect to those proceedings.  

This section shall not prevent a county employee, including a special employee, from acting, with or without compensation, as agent or attorney for or otherwise aiding or assisting members of his immediate family or any person for whom he is serving as guardian, executor, administrator, trustee or other personal fiduciary except in those matters in which he has participated or which are the subject of his official responsibility; provided, that the state or county official responsible for appointment to his position approves.  

This section shall not prevent a present or former special county employee from aiding or assisting another person for compensation in the performance of work under a contract with or for the benefit of the county; provided, that the head of the special county employee's department or agency has certified in writing that the interest of the county requires such aid or assistance and the certification has been filed with the state ethics commission. The certification shall be open to public inspection.  

This section shall not prevent a county employee from giving testimony under oath or making statements required to be made under penalty for perjury or contempt.  

This section shall not prohibit a county employee from holding an elective or appointive office in a city, town or district nor in any way prohibit such an employee from performing the duties or receiving the compensation provided for such office. No such elected or appointed official may vote or act on any matter which is within the purview of the agency by which he is employed or over which such employee has official responsibility.   

",False,http://malegislature.gov/api/Chapters/268A/Sections/11/,"{'Code': 'IV', 'Details': 'http://malegislature.gov/api/Parts/IV'}"
