Chapter,Section,Name,Text,IsRepealed,Details,Part
268A,20,Municipal employees; financial interest in contracts; holding one or more elected positions,"Section 20. (a) A municipal employee who has a financial interest, directly or indirectly, in a contract made by a municipal agency of the same city or town, in which the city or town is an interested party of which financial interest he has knowledge or has reason to know, shall be punished by a fine of not more than $10,000, or by imprisonment in the state prison for not more than 5 years, or in a jail or house of correction for not more than 2 1/2 years, or both.  

This section shall not apply if such financial interest consists of the ownership of less than one per cent of the stock of a corporation.  

This section shall not apply (a) to a municipal employee who in good faith and within thirty days after he learns of an actual or prospective violation of this section makes full disclosure of his financial interest to the contracting agency and terminates or disposes of the interest, or (b) to a municipal employee who is not employed by the contracting agency or an agency which regulates the activities of the contracting agency and who does not participate in or have official responsibility for any of the activities of the contracting agency, if the contract is made after public notice or where applicable, through competitive bidding, and if the municipal employee files with the clerk of the city or town a statement making full disclosure of his interest and the interest of his immediate family, and if in the case of a contract for personal services (1) the services will be provided outside the normal working hours of the municipal employee, (2) the services are not required as part of the municipal employee's regular duties, the employee is compensated for not more than five hundred hours during a calendar year, (3) the head of the contracting agency makes and files with the clerk of the city or town a written certification that no employee of that agency is available to perform those services as part of their regular duties, and (4) the city council, board of selectmen or board of aldermen approve the exemption of his interest from this section, or (c) to a special municipal employee who does not participate in or have official responsibility for any of the activities of the contracting agency and who files with the clerk of the city or town a statement making full disclosure of his interest and the interests of his immediate family in the contract, or (d) to a special municipal employee who files with the clerk of the city, town or district a statement making full disclosure of his interest and the interests of his immediate family in the contract, if the city council or board of aldermen, if there is no city council, board of selectmen or the district prudential committee, approve the exemption of his interest from this section, or (e) to a municipal employee who receives benefits from programs funded by the United States or any other source in connection with the rental, improvement, or rehabilitation of his residence to the extent permitted by the funding agency, or (f) to a municipal employee if the contract is for personal services in a part time, call or volunteer capacity with the police, fire, rescue or ambulance department of a fire district, town or any city with a population of less than thirty-five thousand inhabitants; provided, however, that the head of the contracting agency makes and files with the clerk of the city, district or town a written certification that no employee of said agency is available to perform such services as part of his regular duties, and the city council, board of selectmen, board of aldermen or district prudential committee approve the exemption of his interest from this section or (g) to a municipal employee who has applied in the usual course and is otherwise eligible for a housing subsidy program administered by a local housing authority, unless the employee is employed by the local housing authority in a capacity in which he has responsibility for the administration of such subsidy programs or (h) to a municipal employee who is the owner of residential rental property and rents such property to a tenant receiving a rental subsidy administered by a local housing authority, unless such employee is employed by such local housing authority in a capacity in which he has responsibility for the administration of such subsidy programs.  

This section shall not prohibit an employee or an official of a town from holding the position of selectman in such town nor in any way prohibit such employee from performing the duties of or receiving the compensation provided for such office; provided, however, that such selectman shall not, except as hereinafter provided, receive compensation for more than one office or position held in a town, but shall have the right to choose which compensation he shall receive; provided, further, that no such selectman may vote or act on any matter which is within the purview of the agency by which he is employed or over which he has official responsibility; and, provided further, that no such selectman shall be eligible for appointment to any such additional position while he is still a member of the board of selectmen or for six months thereafter. Any violation of the provisions of this paragraph which has substantially influenced the action taken by any municipal agency in any matter shall be grounds for avoiding, rescinding or cancelling the action on such terms as the interest of the municipality and innocent third parties may require.  

This section shall not prohibit any elected official in a town, whether compensated or uncompensated for such elected position, from holding one or more additional elected positions, in such town, whether such additional elected positions are compensated or uncompensated.  

This section shall not prohibit an employee of a municipality with a city or town council form of government from holding the elected office of councillor in such municipality, nor in any way prohibit such an employee from performing the duties of or receiving the compensation provided for such office; provided, however, that no such councillor may vote or act on any matter which is within the purview of the agency by which he is employed or over which he has official responsibility; and provided, further, that no councillor shall be eligible for appointment to such additional position while a member of said council or for six months thereafter. Any violation of the provisions of this paragraph which has substantially influenced the action taken by a municipal agency in any matter shall be grounds for avoiding, rescinding or cancelling such action on such terms as the interest of the municipality and innocent third parties require. No such elected councillor shall receive compensation for more than one office or position held in a municipality, but shall have the right to choose which compensation he shall receive.  

This section shall not prohibit an employee of a housing authority in a municipality from holding any elective office, other than the office of mayor, in such municipality nor in any way prohibit such employee from performing the duties of or receiving the compensation provided for such office; provided, however, that such elected officer shall not, except as otherwise expressly provided, receive compensation for more than one office or position held in a municipality, but shall have the right to choose which compensation he shall receive; provided further that no such elected official may vote or act on any matter which is within the purview of the housing authority by which he is employed; and provided further that no such elected official shall be eligible for appointment to any such additional position while he is still serving in such elective office or for six months thereafter. Any violation of the provisions of this paragraph which has substantially influenced the action taken by the housing authority in any matter shall be grounds for avoiding, rescinding, or cancelling the action on such terms as the interest of the municipality and innocent third parties may require.  

This section shall not prohibit an employee in a town having a population of less than three thousand five hundred persons from holding more than one appointed position with said town, provided that the board of selectmen approves the exemption of his interest from this section.  

[There is no subsection (b).]   

",False,http://malegislature.gov/api/Chapters/268A/Sections/20/,"{'Code': 'IV', 'Details': 'http://malegislature.gov/api/Parts/IV'}"
268A,21,"Avoiding, rescinding or canceling municipal action resulting from violations of chapter; restitution and damages","Section 21. (a) In addition to any other remedies provided by law, a finding by the commission pursuant to an adjudicatory proceeding that there has been any violation of sections 2, 3, 8, 17 to 20, inclusive, or section 23, which has substantially influenced the action taken by any municipal agency in any particular matter, shall be grounds for avoiding, rescinding or canceling the action of said municipal agency upon request by said municipal agency on such terms as the interests of the municipality and innocent third persons require.  

(b) In addition to the remedies set forth in subsection (a), the commission may, upon a finding pursuant to an adjudicatory proceeding that a person has acted to his economic advantage in violation of sections 2, 3, 8, 17 to 20, inclusive, or section 23, may issue an order (1) requiring the violator to pay the commission on behalf of the municipality damages in the amount of the economic advantage or $500, whichever is greater; and (2) requiring the violator to make restitution to an injured third party. If there has been no final criminal judgment of conviction or acquittal of the same violation, upon receipt of the written approval of the district attorney, the commission may order payment of additional damages in an amount not exceeding twice the amount of the economic advantage or $500, and payment of such additional damages shall bar any criminal prosecution for the same violation. The maximum damages that the commission may order a violator to pay under this section shall be $25,000. If the commission determines that the damages authorized by this section exceed $25,000, it may bring a civil action against the violator to recover such damages.  

(c) The remedies authorized by this section shall be in addition to any civil penalty imposed by the commission in accordance with clause (3) of subsection (j) of section 4 of chapter 268B.   

",False,http://malegislature.gov/api/Chapters/268A/Sections/21/,"{'Code': 'IV', 'Details': 'http://malegislature.gov/api/Parts/IV'}"
268A,21A,Members of municipal commission or board; restrictions on appointments to certain positions,"Section 21A. Except as hereinafter provided, no member of a municipal commission or board shall be eligible for appointment or election by the members of such commission or board to any office or position under the supervision of such commission or board. No former member of such commission or board shall be so eligible until the expiration of thirty days from the termination of his service as a member of such commission or board.  

The provisions of this section shall not apply to a member of a town commission or board, if such appointment or election has first been approved at an annual town meeting of the town.   

",False,http://malegislature.gov/api/Chapters/268A/Sections/21A/,"{'Code': 'IV', 'Details': 'http://malegislature.gov/api/Parts/IV'}"
268A,21B,Prospective municipal appointees; demanding undated resignations prohibited,"Section 21B. No mayor, city manager, or town manager shall require a prospective appointee to a board, commission or position under his jurisdiction to submit as a condition precedent to said appointment an undated resignation from said board, commission or position. Whoever violates the provisions of this section shall be punished by a fine of not more than five hundred dollars.   

",False,http://malegislature.gov/api/Chapters/268A/Sections/21B/,"{'Code': 'IV', 'Details': 'http://malegislature.gov/api/Parts/IV'}"
268A,22,"Opinions of corporation counsel, city solicitor or town counsel","Section 22. Any municipal employee shall be entitled to the opinion of the corporation counsel, city solicitor or town counsel upon any question arising under this chapter relating to the duties, responsibilities and interests of such employee. All requests for such opinions by a subordinate municipal employee shall be made in confidence directly to the chief officer of the municipal agency in which he is employed, who shall in turn request in confidence such opinion of the corporation counsel, city solicitor or town counsel on behalf of such subordinate municipal employee, and all constitutional officers and chief officers or heads of municipal agencies may make direct confidential requests for such opinions on their own account. The town counsel or city solicitor shall file such opinion in writing with the city or town clerk and such opinion shall be a matter of public record; however, no opinion will be rendered by the town counsel or city solicitor except upon the submission of detailed existing facts which raise a question of actual or prospective violation of any provision of this chapter.   

",False,http://malegislature.gov/api/Chapters/268A/Sections/22/,"{'Code': 'IV', 'Details': 'http://malegislature.gov/api/Parts/IV'}"
268A,23,Supplemental provisions; standards of conduct,"Section 23. (a) In addition to the other provisions of this chapter, and in supplement thereto, standards of conduct, as hereinafter set forth, are hereby established for all state, county, and municipal employees.  

(b) No current officer or employee of a state, county or municipal agency shall knowingly, or with reason to know:  

(1) accept other employment involving compensation of substantial value, the responsibilities of which are inherently incompatible with the responsibilities of his public office;  

(2) (i) solicit or receive anything of substantial value for such officer or employee, which is not otherwise authorized by statute or regulation, for or because of the officer or employee's official position; or (ii) use or attempt to use such official position to secure for such officer, employee or others unwarranted privileges or exemptions which are of substantial value and which are not properly available to similarly situated individuals;  

(3) act in a manner which would cause a reasonable person, having knowledge of the relevant circumstances, to conclude that any person can improperly influence or unduly enjoy his favor in the performance of his official duties, or that he is likely to act or fail to act as a result of kinship, rank, position or undue influence of any party or person. It shall be unreasonable to so conclude if such officer or employee has disclosed in writing to his appointing authority or, if no appointing authority exists, discloses in a manner which is public in nature, the facts which would otherwise lead to such a conclusion; or  

(4) present a false or fraudulent claim to his employer for any payment or benefit of substantial value.  

(c) No current or former officer or employee of a state, county or municipal agency shall knowingly, or with reason to know:  

(1) accept employment or engage in any business or professional activity which will require him to disclose confidential information which he has gained by reason of his official position or authority;  

(2) improperly disclose materials or data within the exemptions to the definition of public records as defined by section seven of chapter four, and were acquired by him in the course of his official duties nor use such information to further his personal interest.  

(d) Any activity specifically exempted from any of the prohibitions in any other section of this chapter shall also be exempt from the provisions of this section. The state ethics commission, established by chapter two hundred and sixty-eight B, shall not enforce the provisions of this section with respect to any such exempted activity.  

(e) Where a current employee is found to have violated the provisions of this section, appropriate administrative action as is warranted may also be taken by the appropriate constitutional officer, by the head of a state, county or municipal agency. Nothing in this section shall preclude any such constitutional officer or head of such agency from establishing and enforcing additional standards of conduct.  

(f) The state ethics commission shall adopt regulations: (i) defining substantial value; provided, however, that substantial value shall not be less than $50; (ii) establishing exclusions for ceremonial privileges and exemptions; (iii) establishing exclusions for privileges and exemptions given solely because of family or friendship; and (iv) establishing additional exclusions for other situations that do not present a genuine risk of a conflict or the appearance of a conflict of interest.   

",False,http://malegislature.gov/api/Chapters/268A/Sections/23/,"{'Code': 'IV', 'Details': 'http://malegislature.gov/api/Parts/IV'}"
268A,23A,Trustees of public institutions of higher learning; prohibited positions,"Section 23A. No trustee of any public institution of higher education operated by the commonwealth shall be eligible to be appointed to or hold any other office or position with said institution for a period of three years next after the termination of his services as such trustee, or in the case of an elected student trustee at said institution, for a period of one year next after the termination of his services as such trustee; provided, however, that any such elected student trustee may accept and hold part-time employment at said institution while a student thereat, and provided further, that a trustee may be appointed to or hold an unpaid office or position with said institution after his services as such trustee.   

",False,http://malegislature.gov/api/Chapters/268A/Sections/23A/,"{'Code': 'IV', 'Details': 'http://malegislature.gov/api/Parts/IV'}"
268A,24,Disclosures and certifications; form; public inspection,"Section 24. All disclosures and certifications provided for in this chapter and made in accordance with its provisions shall be made in writing and, unless otherwise specifically provided in this chapter, shall be kept open to inspection by the public by the official with whom such disclosure has been filed.   

",False,http://malegislature.gov/api/Chapters/268A/Sections/24/,"{'Code': 'IV', 'Details': 'http://malegislature.gov/api/Parts/IV'}"
268A,25,Suspension of persons under indictment for misconduct in office; notice; compensation and fringe benefits; temporary replacements; reinstatement,"Section 25. An officer or employee of a county, city, town or district, howsoever formed, including, but not limited to, regional school districts and regional planning districts, or of any department, board, commission or agency thereof may, during any period such officer or employee is under indictment for misconduct in such office or employment or for misconduct in any elective or appointive public office, trust or employment at any time held by him, be suspended by the appointing authority, whether or not such appointment was subject to approval in any manner. Notice of said suspension shall be given in writing and delivered in hand to said person or his attorney, or sent by registered mail to said person at his residence, his place of business, or the office or place of employment from which he is being suspended. Such notice so given and delivered or sent shall automatically suspend the authority of such person to perform the duties of his office or employment until he is notified in like manner that his suspension is removed. A copy of any such notice together with an affidavit of service shall be filed as follows: in the case of a county, with the clerk of the superior court of the county in which the officer or employee is employed; in the case of a city, with the city clerk; in the case of a town, with the town clerk; in the case of a regional school district, with the secretary of the regional school district; and in the case of all other districts, with the clerk of the district.  

Any person so suspended shall not receive any compensation or salary during the period of suspension, nor shall the period of his suspension be counted in computing his sick leave or vacation benefits or seniority rights, nor shall any person who retires from service while under such suspension be entitled to any pension or retirement benefits, notwithstanding any contrary provisions of law, but all contributions paid by him into a retirement fund, if any, shall be returned to him, subject to section 15 of chapter 32. The employer of a person so suspended shall immediately notify the retirement system of which the person is a member of the suspension and shall notify the retirement board of the outcome of any charges brought against the individual.  

A suspension under this section shall not, in any way, be used to prejudice the rights of the suspended person either civilly or criminally. During the period of any such suspension, the appointing authority may fill the position of the suspended officer or employee on a temporary basis, and the temporary officer or employee shall have all the powers and duties of the officer or employee suspended.  

Any such temporary officer or employee who is appointed as a member of a board, commission or agency may be designated as chairman.  

If the criminal proceedings against the person suspended are terminated without a finding or verdict of guilty on any of the charges on which he was indicted, his suspension shall be forthwith removed, and he shall receive all compensation or salary due him for the period of his suspension, and the time of his suspension shall count in determining sick leave, vacation, seniority and other rights, and shall be counted as creditable service for purposes of retirement.   

",False,http://malegislature.gov/api/Chapters/268A/Sections/25/,"{'Code': 'IV', 'Details': 'http://malegislature.gov/api/Parts/IV'}"
268A,26,Penalty for violations of clause (b)(2) or (b)(4) of Sec. 23,"Section 26. (a) Any person who, directly or through another, with fraudulent intent, violates clause (2) or (4) of subsection (b) of section 23, or any person who, with fraudulent intent, causes any other person to violate said clauses (2) or (4) of said subsection (b) of said section 23 or with fraudulent intent offers or gives any privileges or exemptions of substantial value in violation of said clause (2) or (4) of said subsection (b) of said section 23, shall be punished by a fine of not more than $10,000, or by imprisonment in the state prison for not more than 5 years, or in a jail or house of correction for not more than 2 1/2 years, or both, if the unwarranted privileges or exemptions have a fair market value in the aggregate of more than $1,000 in any 12 month period.  

[There is no subsection (b).]   

",False,http://malegislature.gov/api/Chapters/268A/Sections/26/,"{'Code': 'IV', 'Details': 'http://malegislature.gov/api/Parts/IV'}"
268A,27,Publication of summaries of Chapter 268A; filing of acknowledgment by employees,"Section 27. The commission shall prepare, and update as necessary, summaries of this chapter for state, county, and municipal employees, respectively, which the commission shall publish on its official website. Every state, county and municipal employee shall, within 30 days of becoming such an employee, and on an annual basis thereafter, be furnished with a summary of this chapter prepared by the commission and sign a written acknowledgment that he has been provided with such a summary. Municipal employees shall be furnished with the summary by, and file an acknowledgment with, the city or town clerk. Appointed state and county employees shall be furnished with the summary by, and file an acknowledgment with, the employee's appointing authority or his designee. Elected state and county employees shall be furnished with the summary by, and file an acknowledgment with, the commission. The commission shall establish procedures for implementing this section and ensuring compliance.   

",False,http://malegislature.gov/api/Chapters/268A/Sections/27/,"{'Code': 'IV', 'Details': 'http://malegislature.gov/api/Parts/IV'}"
268A,28,Online training programs,"Section 28. The state ethics commission shall prepare and update from time to time the following online training programs, which the commission shall publish on its official website: (1) a program which shall provide a general introduction to the requirements of this chapter; and (2) a program which shall provide information on the requirements of this chapter applicable to former state, county, and municipal employees. Every state, county, and municipal employee shall, within 30 days after becoming such an employee, and every 2 years thereafter, complete the online training program. Upon completion of the online training program, the employee shall provide notice of such completion to be retained for 6 years by the appropriate employer.  

The commission shall establish procedures for implementing this section and ensuring compliance.   

",False,http://malegislature.gov/api/Chapters/268A/Sections/28/,"{'Code': 'IV', 'Details': 'http://malegislature.gov/api/Parts/IV'}"
