Chapter,Section,Name,Text,IsRepealed,Details,Part
271,23,"Oath and warrant to enter gaming or lottery place, arrest persons and seize implements and materials; disposal of articles","Section 23. If a person makes oath before a district court or justice of the peace authorized to issue warrants in criminal cases that he suspects or has probable cause to suspect that a house or other building, room or place is used as and for a common gaming house, for gaming for money or other property, or is occupied, used or kept for promoting a lottery, or for the sale of lottery tickets, or for promoting the game known as policy lottery or policy, or for the buying or selling of pools or registering of bets upon any race, game, contest, act or event, and that persons resort thereto for any such purpose, such court or justice, whether the names of the persons last mentioned are known to the complainant or not, shall, if satisfactory evidence is presented, issue a warrant commanding the sheriff or his deputy or any constable or police officer to enter such house, building, room or place, and to arrest the keepers thereof, all persons in any way assisting in keeping the same, whether as janitor, doorkeeper, watchman or otherwise, all persons who are there found participating in any form of gaming and all persons present whether so participating or not, if any lottery, policy or pool tickets, slips, checks, manifold books or sheets, memoranda of any bet, or other implements, apparatus or materials of any form of gaming are found in said place, and to take into their custody all the implements, apparatus or materials of gaming, as aforesaid, and all the personal property, including money, furniture and fixtures there found, and to keep said persons, implements, apparatus or materials, property, including money, furniture and fixtures so that they may be forthcoming before some court or magistrate to be dealt with according to law. The provisions of chapter two hundred and seventy-six relative to disposal of gaming articles seized upon search warrants shall apply to all articles and property seized as herein provided for; provided, however, that such provisions shall not apply to gaming conducted pursuant to chapter 23K and shall not apply to sports wagering conducted pursuant to chapter 23N.   

",False,http://malegislature.gov/api/Chapters/271/Sections/23/,"{'Code': 'IV', 'Details': 'http://malegislature.gov/api/Parts/IV'}"
271,24,"Race tracks; owners, proprietors of, or persons present","Section 24. This chapter shall not authorize the arrest or conviction of the owner or proprietor of a race track or trotting course for the reason that another person has without his knowledge or consent violated any of its provisions relative to the buying and selling of pools or the registering or making of bets or to any offence mentioned in the preceding section; nor the arrest or conviction of a person for being present on a race track or trotting course where pools are sold or bets registered or made on trials of speed or endurance between horses or other animals; but this exception shall not apply to a person in any way participating or assisting in the buying or selling of pools or registering of bets.   

",False,http://malegislature.gov/api/Chapters/271/Sections/24/,"{'Code': 'IV', 'Details': 'http://malegislature.gov/api/Parts/IV'}"
271,25,Obstructions barring access to gaming places; removal; lien of expenses,"Section 25. If a captain of police in Boston or marshal or chief of police in any other city or town in the commonwealth finds that access to any building, apartment or place which he has reasonable cause to believe is resorted to for the purpose of unlawful gaming is barred by any obstruction, such as a door, window, shutter, screen, bar or grating of unusual strength, other than what is usual in ordinary places of business, or any unnecessary number of doors, windows or obstructions, he shall order the same removed by the owner or agent of the building where such obstruction exists, and if any of said officers cannot find either of the persons mentioned, so as to make personal service, said notice shall be posted upon the outside of the apartments and on the outside of said building, and upon the neglect to remove such obstruction for seven days from the date of said order or posting of said notices, any of said officers shall cause such obstruction to be removed from such building, and the expense of such removal shall be a lien on said building and be collected by the officer removing such obstruction, in the manner in which a mechanic's lien is collected.   

",False,http://malegislature.gov/api/Chapters/271/Sections/25/,"{'Code': 'IV', 'Details': 'http://malegislature.gov/api/Parts/IV'}"
271,26,Subsequent obstructions; removal; punishment; lien,"Section 26. If, within one year after removal of said obstruction, the premises are again obstructed as above defined, the captain of police or marshal or chief of police shall have the same power of removal as provided in the preceding section, and in addition the owner or agent when such second order of removal is given, either by personal service or by posting on the building, shall be punished by a fine of not less than two hundred and fifty nor more than five hundred dollars, and the amount of said fine shall be a lien upon said building and be collected in like manner as provided in the preceding section. And for every subsequent obstruction as above defined, at any time within two years of the giving of the second notice, as above provided, said officers shall have the same powers as provided in the preceding section for removing the obstructions, and the owner or agent at the time such third or subsequent order of removal is given, either by personal service or by posting on the building, shall be punished by a fine of not less than five hundred nor more than one thousand dollars or may be punished by imprisonment for one year, and the amount of said fine shall be a lien upon the said building, and shall be collected in like manner as above provided.  Obstructions as above defined, erected more than two years after the giving of the notice of the third offence, shall be construed to be a first offence under this section.   

",False,http://malegislature.gov/api/Chapters/271/Sections/26/,"{'Code': 'IV', 'Details': 'http://malegislature.gov/api/Parts/IV'}"
271,27,"Judicial notice of methods and character of lotteries, policy games, pools and betting; prima facie evidence","Section 27. Any court or magistrate having criminal jurisdiction may take judicial notice of the general methods and character of lotteries, policy lotteries or the game called policy, pools or combination bets, and the buying and selling of pools and registering of bets. In the trial of a complaint or indictment to which it may be relevant, any lottery, policy or pool ticket, certificate, slip or check, manifold or other policy or pool book or sheet, or memorandum of any pool or sale of pools, or of a bet or odds, or combination bet, or any other implement, apparatus, materials or articles of a character commonly employed in or in connection with lotteries, policy lotteries or policy, the buying or selling of pools or registering of bets, or other form of gaming, shall be prima facie evidence of the existence and unlawful character of a lottery, policy lottery or game, pool or pools, bet, game or hazard, or other form of gaming in which like articles are commonly used, and that such article has relation thereto; provided, however, that such provisions shall not apply to sports wagering conducting pursuant to chapter 23N.   

",False,http://malegislature.gov/api/Chapters/271/Sections/27/,"{'Code': 'IV', 'Details': 'http://malegislature.gov/api/Parts/IV'}"
271,28,Lotteries or illegal gaming; complaints and indictments,"Section 28. No plea of misnomer shall be received to a complaint or indictment for violation of any law relative to lotteries, policy lotteries or policy, the selling of pools or registering of bets, or any form of illegal gaming; but the defendant may be arraigned, tried, sentenced and punished under any name by which he is complained of or indicted. No such complaint or indictment shall be abated, quashed or held insufficient by reason of any alleged defect, either of form or substance, if the same is sufficient to enable the defendant to understand the charge and to prepare his defence. No variance between such complaint or indictment and the evidence shall be deemed material, unless in some matter of substance essential to the charge under the rule above prescribed; provided, however, that such provisions shall not apply to sports wagering conducted pursuant to chapter 23N.   

",False,http://malegislature.gov/api/Chapters/271/Sections/28/,"{'Code': 'IV', 'Details': 'http://malegislature.gov/api/Parts/IV'}"
271,29,"Sale, exchange or disposition of property; misrepresentation","Section 29. Whoever sells, exchanges or disposes of any property, or offers or attempts so to do, upon a representation, advertisement, notice or inducement that anything other than what is specifically stated to be the subject of the sale or exchange is or is to be delivered or received, or is in any way connected with or is a part of the transaction, or whoever gives a stamp, coupon or other device which entitles a purchaser to demand or receive from a person or company other than the merchant dealing in the goods purchased or the manufacturer thereof, any other property than that actually sold or exchanged, or whoever delivers by any person or company other than the merchant dealing in the goods purchased, or the manufacturer thereof, goods, wares or merchandise upon the presentation of such stamp, coupon or other device, shall be punished by a fine of not less than ten nor more than five hundred dollars.   

",False,http://malegislature.gov/api/Chapters/271/Sections/29/,"{'Code': 'IV', 'Details': 'http://malegislature.gov/api/Parts/IV'}"
271,30,Trading stamps or similar devices; sale or delivery,"Section 30. Whoever, in connection with the sale of any article or any merchandise whatsoever, sells, gives or delivers any trading stamps, checks, coupons or similar devices to be exchanged for, or to be redeemed by the giving of, any indefinite or undescribed article, the nature and value of which are not stated, or to be exchanged for, or to be redeemed by the giving of, any article not distinctly bargained for at the time when such trading stamps or other devices as aforesaid were sold, given or delivered, shall be punished by a fine of not less than ten nor more than fifty dollars.   

",False,http://malegislature.gov/api/Chapters/271/Sections/30/,"{'Code': 'IV', 'Details': 'http://malegislature.gov/api/Parts/IV'}"
271,31,Racing horses for bets or stakes,"Section 31. Whoever, except in trials of speed of horses for premiums offered by legally constituted agricultural societies, or by corporations authorized thereto by section fourteen of chapter one hundred and eighty, engages in racing, running, trotting or pacing a horse or other animal of the horse kind for a bet, wager of money or other thing of value or a purse or stake made within the commonwealth, or whoever aids or abets therein, shall be punished by a fine of not more than one thousand dollars or by imprisonment for not more than one year, or both. This section shall not apply to racing conducted pursuant to chapter 23K.   

",False,http://malegislature.gov/api/Chapters/271/Sections/31/,"{'Code': 'IV', 'Details': 'http://malegislature.gov/api/Parts/IV'}"
271,31A,Racing results or information; transmission for unlawful purposes,"Section 31A. Whoever transmits the results of a race, or information as to the progress of a race during the running thereof, in a racing meeting as defined in section one of chapter one hundred and twenty-eight A, by any means to another knowing that such results or information is to be used or intended to be used for unlawful purposes or in furtherance of unlawful gambling, shall be punished by a fine of not more than five thousand dollars or by imprisonment in a jail or house of correction for not more than two and one half years or in the state prison for not more than five years, or by both such fine and imprisonment.  

This section shall not be construed as prohibiting a newspaper from printing such results for publication as news, or a television or radio station from telecasting or broadcasting such results or information as news.   

",False,http://malegislature.gov/api/Chapters/271/Sections/31A/,"{'Code': 'IV', 'Details': 'http://malegislature.gov/api/Parts/IV'}"
271,32,Horse racing; fraud,"Section 32. Whoever, for the purpose of competing for a purse or premium offered by an agricultural society, or by a person or association in the commonwealth, knowingly and designedly enters or drives a horse that is painted or disguised, or is a different horse from the one that purports to be entered or driven, or knowingly and designedly, for the purpose of competing for a premium or purse, enters or drives a horse in a class to which it does not belong, shall be punished by a fine of not more than five hundred dollars or by imprisonment for not more than six months.   

",False,http://malegislature.gov/api/Chapters/271/Sections/32/,"{'Code': 'IV', 'Details': 'http://malegislature.gov/api/Parts/IV'}"
271,33,Race grounds in towns,"Section 33. No land within a town shall be laid out or used as a race ground or trotting park without the previous consent of and location by the mayor and city council, the town council in a town having a town council or the selectmen in any other town, who may regulate and alter the terms and conditions under which the same shall be laid out, used or continued in use and may discontinue the same when in their judgment the public good so requires; and no land shall be used for any of the purposes declared unlawful in section thirty-one.   

",False,http://malegislature.gov/api/Chapters/271/Sections/33/,"{'Code': 'IV', 'Details': 'http://malegislature.gov/api/Parts/IV'}"
271,34,Race grounds as nuisance; abatement,"Section 34. Every race ground or trotting park established, laid out, used or continued in use contrary to this chapter is declared a common nuisance and may be abated as such; and all persons owning, keeping, using or permitting to be used such race ground or trotting park, or aiding or abetting therein, shall be punished by a fine of not more than one thousand dollars or by imprisonment for not more than one year, or both.   

",False,http://malegislature.gov/api/Chapters/271/Sections/34/,"{'Code': 'IV', 'Details': 'http://malegislature.gov/api/Parts/IV'}"
271,35,Definition of words and phrases used in Secs. 35 to 38,"Section 35. The following words and phrases used in this and the three following sections of this chapter shall, unless a different meaning is required by the context, have the following meanings:  

''Person'', an individual, partnership, corporation or association, whether acting in his or their own right or as the officer, agent, servant, correspondent or representative of another.  

''Contract'', any agreement, trade or transaction.  

''Securities'', all evidences of debt or property and options for the purchase and sale thereof, shares in any corporation, joint stock company or association, bonds, coupons, scrip, rights, choses in action and other evidences of debt or property and options for the purchase or sale thereof.  

''Commodities'', anything movable that is bought and sold.  

''Bucket shop'', any room, office, store, building or other place where any contract prohibited by the following section is made or offered to be made.  

''Keeper'', any person owning, keeping, managing, operating or promoting a bucket shop, or assisting to keep, manage, operate or promote a bucket shop.  

''Bucketing'' or ''Bucket-shopping'',  

(a) The making of, or offering to make, any contract respecting the purchase or sale, either upon credit or upon margin, of any securities or commodities, wherein both parties thereto intend, or such keeper intends, that such contract shall be, or may be, terminated, closed or settled according to, or upon the basis of, the public market quotations of prices made on any board of trade or exchange upon which said securities or commodities are dealt in, and without a bona fide purchase or sale of the same; or  

(b) The making of, or offering to make, any contract respecting the purchase or sale, either upon credit or upon margin, of any securities or commodities, wherein both parties intend, or such keeper intends, that such contract shall be, or may be, deemed terminated, closed or settled, when such public market quotations of prices for the securities or commodities named in such contract shall reach a certain figure without a bona fide purchase or sale of the same; or  

(c) The making of, or offering to make, any contract respecting the purchase or sale, either upon credit or upon margin, of any securities or commodities, wherein both parties do not intend, or such keeper does not intend, the actual or bona fide receipt or delivery of such securities or commodities, but do intend, or such keeper does intend, a settlement of such contract based upon the differences in such public market quotations of prices at which said securities or commodities are, or are asserted to be, bought and sold.   

",False,http://malegislature.gov/api/Chapters/271/Sections/35/,"{'Code': 'IV', 'Details': 'http://malegislature.gov/api/Parts/IV'}"
271,36,Bucketing contracts; keeper of shop; domestic and foreign corporations,"Section 36. Whoever makes, or offers to make, any contract of bucketing or bucket-shopping, or who is the keeper of any bucket shop, shall be punished by a fine of not more than one thousand dollars or by imprisonment for not more than one year. Whoever shall be convicted of a second offence shall be punished by imprisonment for not more than five years. The continuing of the keeping of a bucket shop, by any person, after the first conviction therefor, shall be deemed a second offence hereunder. If a domestic corporation shall be convicted of a second offence, the supreme judicial court may, upon an information in equity in the name of the attorney general, at the relation of the commissioner of revenue, dissolve the corporation; and if a foreign corporation shall be convicted of a second offence, the supreme judicial court may, in the same manner, restrain it from doing business in this commonwealth.   

",False,http://malegislature.gov/api/Chapters/271/Sections/36/,"{'Code': 'IV', 'Details': 'http://malegislature.gov/api/Parts/IV'}"
271,37,Prohibited contracts; price quotations,"Section 37. Whoever shall communicate, receive, exhibit or display in any manner any statement of quotations of prices of any securities or commodities with an intent to make, or offer to make, or to aid in making, or offering to make, any contract prohibited by the preceding section shall be punished as provided therein.   

",False,http://malegislature.gov/api/Chapters/271/Sections/37/,"{'Code': 'IV', 'Details': 'http://malegislature.gov/api/Parts/IV'}"
271,38,Purchases and sales of securities or commodities; written statement,"Section 38. Every person shall furnish, upon demand, to any customer or principal for whom such person has executed any order for the actual purchase or sale of any securities or commodities, either for immediate or future delivery, a written statement containing the names of the persons from whom such property was bought, or to whom it has been sold, as the fact may be, the time when, place where and the price at which the same was either bought or sold; and if such person refuses or neglects to furnish such statement within twenty-four hours after such demand, such refusal or neglect shall be prima facie evidence that such purchase or sale was bucketing or bucket-shopping.   

",False,http://malegislature.gov/api/Chapters/271/Sections/38/,"{'Code': 'IV', 'Details': 'http://malegislature.gov/api/Parts/IV'}"
271,39,Gifts to influence business affairs; threats,"Section 39. (a) Whoever, in relation to any transaction or matter concerning the business affairs of an employer, principal or beneficiary (1) offers, gives or agrees to give an agent or fiduciary of another person any benefit or anything of value with intent to influence the recipient's conduct, or (2) as an agent or fiduciary, solicits, accepts or agrees to accept any benefit or anything of value from another person who is not an employee, principal, or beneficiary upon an agreement or understanding that such benefit or thing of value will influence his conduct, shall be punished by imprisonment in the state prison for not more than five years, or by a fine of not more than ten thousand dollars, or both.  

(b) Whoever, verbally or by a written or printed communication, threatens an economic injury to another, or threatens to deprive another of an economic opportunity, with intent to compel that person to do any act, involving the use or disposition of anything of value against his will, shall be punished by imprisonment in the state prison for not more than five years, or in the house of correction for not more than two years, or by a fine of not more than five thousand dollars, or both. The provisions of this paragraph shall not apply to any labor disputes as defined in section two of chapter one hundred and fifty A.   

",False,http://malegislature.gov/api/Chapters/271/Sections/39/,"{'Code': 'IV', 'Details': 'http://malegislature.gov/api/Parts/IV'}"
271,39A,"Gifts to influence action of participants in, and others connected with, a game or contest","Section 39A. Whoever gives, promises or offers to any professional or amateur baseball, football, hockey, polo, tennis or basketball player or any boxer or any player who participates or expects to participate in any professional or amateur game or sport or any jockey, driver or groom or any person participating or expecting to participate in any horse race, including owners of race tracks and their employees, stewards, trainers, judges, starters or special policemen, or to any manager, coach or trainer of any team or participant or prospective participant in any such game, contest or sport, any valuable thing with intent to influence him to lose, or try to lose, or cause to be lost, or to limit his or his team's margin of victory in, a baseball, football, hockey or basketball game, boxing, tennis or polo match or a horse race or any professional or amateur sport, or game, in which such player or participant or jockey or driver, is taking part or expects to take part, or has any duty or connection therewith, or whoever, being a professional or amateur baseball, football, hockey, basketball, tennis or polo player, boxer, or jockey, driver, or groom or participant or prospective participant in any sport or game or a manager, coach or trainer of any team or individual participant or prospective participant in any such game, contest or sport, solicits or accepts any valuable thing to influence him to lose, or try to lose, or cause to be lost, or to limit his or his team's margin of victory in, a baseball, football, hockey or basketball game or boxing, tennis or polo match, or horse race or any game of sport in which he is taking part, or expects to take part, or has any duty or connection therewith, shall be punished by a fine of not more than one thousand dollars or by imprisonment for not more than two years, or both.   

",False,http://malegislature.gov/api/Chapters/271/Sections/39A/,"{'Code': 'IV', 'Details': 'http://malegislature.gov/api/Parts/IV'}"
