Chapter,Section,Name,Text,IsRepealed,Details,Part
271,1,Gaming or betting; forfeiture,"Section 1. Whoever, on a prosecution commenced within eighteen months after the commission of the crime, is convicted of winning at one time or sitting, by gaming or betting on the sides or hands of those gaming, except as permitted under chapters 23K and 23N, money or goods to the value of five dollars or more, and of receiving the same or security therefor, shall forfeit double the value of such money or goods.   

",False,http://malegislature.gov/api/Chapters/271/Sections/1/,"{'Code': 'IV', 'Details': 'http://malegislature.gov/api/Parts/IV'}"
271,1A,"''House'', ''building'' and ''place'' including ship or vessel","Section 1A. The words ''house'', ''building'' and ''place'' used severally or together in this chapter shall mean and include a ship or vessel when it is within the territorial limits of the commonwealth.   

",False,http://malegislature.gov/api/Chapters/271/Sections/1A/,"{'Code': 'IV', 'Details': 'http://malegislature.gov/api/Parts/IV'}"
271,2,Gaming or betting in public conveyance or place or while trespassing in private place; arrest without warrant,"Section 2. Whoever, in a public conveyance or public place, or in a private place upon which he is trespassing, plays at cards, dice or any other game for money or other property, or bets on the sides or hands of those playing, except as permitted under chapters 23K and 23N, shall forfeit not more than fifty dollars or be imprisoned for not more than three months; and whoever sets up or permits such a game shall be punished by a fine of not less than fifty nor more than one hundred dollars or by imprisonment for not less than three nor more than twelve months. If discovered in the act, he may be arrested without a warrant by a sheriff, deputy sheriff, constable or any officer qualified to serve criminal process, and held in custody, in jail or otherwise, for not more than twenty-four hours, Sunday and legal holidays excepted, until complaint may be made against him for such offence.   

",False,http://malegislature.gov/api/Chapters/271/Sections/2/,"{'Code': 'IV', 'Details': 'http://malegislature.gov/api/Parts/IV'}"
271,3,Innholders and others keeping or suffering implements to be used for gaming,"Section 3. Except as permitted under chapters 23K and 23N, every innholder, common victualler or person keeping or suffering to be kept in any place occupied by him implements such as are used in gaming, in order that the same may for hire, gain or reward be used for amusement, who suffers implements of such kind to be used upon any part of such premises for gaming for money or other property, or who suffers a person to play at an unlawful game or sport therein, shall for the first offence forfeit not more than one hundred dollars or be imprisoned for not more than three months; and for a subsequent offence shall be imprisoned for not more than one year. In either case he shall further recognize with sufficient sureties in a reasonable sum for his good behavior, and especially that he will not be guilty of any offence against any of the provisions of sections one to six, inclusive, for three years from the date of the recognizance.   

",False,http://malegislature.gov/api/Chapters/271/Sections/3/,"{'Code': 'IV', 'Details': 'http://malegislature.gov/api/Parts/IV'}"
271,4,"Gaming in inns and other occupied places; use of billiard table, bowling alley or other implement for gaming","Section 4. Whoever, in any place mentioned in the preceding section, for the purpose of gaming for money or other property, uses or takes part in using a billiard table, bowling alley or other implement of gaming, or there plays at an unlawful game or sport, or, for the purpose of such gaming, uses or takes part in using a billiard table or bowling alley kept by a person licensed under chapter one hundred and forty, shall forfeit not more than fifty dollars.   

",False,http://malegislature.gov/api/Chapters/271/Sections/4/,"{'Code': 'IV', 'Details': 'http://malegislature.gov/api/Parts/IV'}"
271,5,"Gaming, lottery, pool or betting houses; tables or apparatus for gaming","Section 5. Whoever, except as permitted under chapters 23K and 23N, keeps or assists in keeping a common gaming house, or building or place occupied, used or kept for the purposes described in section twenty-three, or is found playing or present as provided in said section, or commonly keeps or suffers to be kept, in a building or place actually used and occupied by him, tables or other apparatus for the purpose of playing at an unlawful game or sport for money or any other valuable thing, shall be punished by a fine of not more than fifty dollars or by imprisonment for not more than three months.   

",False,http://malegislature.gov/api/Chapters/271/Sections/5/,"{'Code': 'IV', 'Details': 'http://malegislature.gov/api/Parts/IV'}"
271,5A,Gambling devices; forfeiture; antique slot machines,"Section 5A. Whoever manufactures, transports, sells, offers for sale, stores, displays, repairs, reconditions, possesses or uses any gambling device or parts for use therein shall be punished by a fine of not more than five thousand dollars; provided, however, that fifty percent of the said fine shall be remitted to the city or town in which the violation occurred. The remaining fifty percent shall be remitted to the general fund of the commonwealth. As used in this section, the term ''gambling device'' means any so called ''slot machine'' or any other machine or mechanical device an essential part of which is a drum or reel with insignia thereon, and which, when operated, may deal, as a result of the application of an element of chance, any money or property; or by the operation of which a person may become entitled to receive, as the result of the application of an element of chance, any money or property; or any sub-assembly or essential part intended to be used in connection with any such machine or mechanical device. Any gambling device or parts for use therein manufactured, transported, sold, offered for sale, stored, displayed, repaired, reconditioned, possessed or used in violation of this section shall be seized and be forfeited to the commonwealth and disposed of in the manner provided under the provisions of chapter two hundred and seventy-six. In respect to their constitutionality, the provisions of this section are hereby declared to be separable.  

It shall be a defense to any prosecution under this section to show that the slot machine is an antique slot machine and was not operated for gambling purposes while in the defendant's possession. For the purposes of this section, a slot machine shall be presumed to be an antique slot machine, if it was manufactured at least thirty years prior to either the arrest of the defendant, or seizure of the machine.  

This section shall not apply to persons who manufacture, transport, sell, offer for sale, store, display, repair, recondition, possess or use any gambling device or parts for use in such a device for licensed gaming conducted under chapter 23K or sports wagering conducted pursuant to chapter 23N.   

",False,http://malegislature.gov/api/Chapters/271/Sections/5A/,"{'Code': 'IV', 'Details': 'http://malegislature.gov/api/Parts/IV'}"
271,5B,Unlawful possession of electronic machine or device for conducting or promoting sweepstakes through entertaining display; lawful exceptions; penalty,"Section 5B. (a) As used in this section the following words shall, unless the context clearly requires otherwise, have the following meanings:&mdash;  

''Electronic machine or device'', a mechanically, electrically or electronically operated machine or device that is: (i) owned, leased or otherwise possessed by a sweepstakes sponsor or promoter, or any sponsors, promoters, partners, affiliates, subsidiaries or contractors thereof; (ii) intended to be used by a sweepstakes entrant; (iii) uses energy; and (iv) capable of displaying information on a screen or other mechanism; provided, that an electronic machine or device may, without limitation: (1) be server-based; (2) use a simulated game terminal as a representation of the prizes associated with the results of the sweepstakes entries; (3) utilize software such that the simulated game influences or determines the winning or value of the prize; (4) select prizes from a predetermined finite pool of entries; (5) utilize a mechanism that reveals the content of a predetermined sweepstakes entry; (6) predetermine the prize results and stores those results for delivery at the time the sweepstakes entry results are revealed; (7) utilize software to create a game result; (8) require deposit of any money, coin or token, or the use of any credit card, debit card, prepaid card or any other method of payment to activate the electronic machine or device; (9) require direct payment into the electronic machine or device, or remote activation of the electronic machine or device; (10) require purchase of a related product having legitimate value; (11) reveal the prize incrementally, even though it may not influence if a prize is awarded or the value of any prize awarded; (12) determine and associate the prize with an entry or entries at the time the sweepstakes is entered; (13) be a slot machine or other form of electrical, mechanical, or computer game; and provided further, that ''electronic machine or device'' shall also include gambling devices as defined in section 5A.  

''Enter'' or ''entry'', the act or process by which a person becomes eligible to receive any prize offered in a sweepstakes.  

''Entertaining display'', any visual information, capable of being seen by a sweepstakes entrant, that takes the form of actual game play or simulated game play.  

''Prize'', any gift, award, gratuity, good, service, credit or anything else of value, which may be transferred to a person, whether possession of the prize is actually transferred, or placed on an account or other record as evidence of the intent to transfer the prize.  

''Sweepstakes'', any game, advertising scheme or plan, or other promotion, which, with or without payment of any consideration, a person may enter to win or become eligible to receive any prize, the determination of which is based upon chance.  

(b) It shall be unlawful for any person to knowingly possess with the intent to operate, or place into operation, an electronic machine or device to: (1) conduct a sweepstakes through the use of an entertaining display, including the entry process or the reveal of a prize; or (2) promote a sweepstakes that is conducted through the use of an entertaining display, including the entry process or the reveal of a prize.  

(c) Nothing in this section shall be construed to make illegal any activity which is lawfully conducted: (1) by the state lottery commission, under sections 24, 24A, 27, 27A, 37, 38, and 39A of chapter 10; (2) as pari-mutuel wagering on horse races, whether live or simulcast, under chapters 128A and 128C; (3) as the game of bingo conducted under chapters 10 and 271; (4) as charitable gaming, conducted under chapter 271; (5) under chapters 23K and 23N; or (6) by any retailer whose primary business is the sale of groceries, whereby the sweepstakes is directly related to the sale of groceries and the potential prize provided through the sweepstakes may not be redeemed for cash and may only be used as a discount to reduce the price of items purchased from the retailer.  

(d) Any person who violates this section shall be punished by a fine of not more than $250,000 per electronic machine or device placed into operation or by imprisonment in state prison for not more than 15 years, or by both such fine and imprisonment.   

",False,http://malegislature.gov/api/Chapters/271/Sections/5B/,"{'Code': 'IV', 'Details': 'http://malegislature.gov/api/Parts/IV'}"
271,6,"Gaming relative to cattle shows, military muster or public gathering; arrest without warrant","Section 6. Whoever, during or within twelve hours of the time of holding a cattle show, military muster or public gathering, within one mile of the place thereof, practices or engages in illegal gaming, shall forfeit not more than twenty dollars. If discovered in the act, he may be arrested without a warrant by any sheriff, deputy sheriff, constable or any officer qualified to serve criminal process, and held in custody, in jail or otherwise, for not more than twenty-four hours, Sunday and legal holidays excepted, until a complaint may be made against him for such offence.   

",False,http://malegislature.gov/api/Chapters/271/Sections/6/,"{'Code': 'IV', 'Details': 'http://malegislature.gov/api/Parts/IV'}"
271,6A,Plans under which purchasers agree to obtain more purchasers; injunction; receivers,"Section 6A. Whoever sets up or promotes a plan by which goods or anything of value is sold to a person for a consideration and upon the further consideration that the purchaser agrees to secure one or more persons to participate in the plan by respectively making a similar purchase or purchases and in turn agreeing to secure one or more persons likewise to join in the said plan, each purchaser being given the right to secure money, credits, goods or something of value, depending upon the number of persons joining in the plan, shall be held to have set up and promoted a lottery and shall be punished as provided in section seven. The supreme judicial court shall have jurisdiction in equity upon a petition filed by the attorney general to enjoin the further prosecution of any such plan and to appoint receivers to secure and distribute the assets received thereunder.   

",False,http://malegislature.gov/api/Chapters/271/Sections/6A/,"{'Code': 'IV', 'Details': 'http://malegislature.gov/api/Parts/IV'}"
271,6B,Skilo and similar games,"Section 6B. Whoever, except as provided in section twenty-two B, sets up or promotes the game commonly known as skilo or any similar game regardless of name, shall be held to have set up and promoted a lottery and shall be punished as provided in section seven.   

",False,http://malegislature.gov/api/Chapters/271/Sections/6B/,"{'Code': 'IV', 'Details': 'http://malegislature.gov/api/Parts/IV'}"
271,6C,nan,nan,False,http://malegislature.gov/api/Chapters/271/Sections/6C/,nan
271,7,Lotteries; disposal of property by chance,"Section 7. Whoever sets up or promotes a lottery for money or other property of value, or by way of lottery disposes of any property of value, or under the pretext of a sale, gift or delivery of other property or of any right, privilege or thing whatever disposes of or offers or attempts to dispose of any property, with intent to make the disposal thereof dependent upon or connected with chance by lot, dice, numbers, game, hazard or other gambling device that is not taking place in a gaming establishment licensed pursuant to chapter 23K, whereby such chance or device is made an additional inducement to the disposal or sale of said property, and whoever aids either by printing or writing, or is in any way concerned, in the setting up, managing or drawing of such lottery, or in such disposal or offer or attempt to dispose of property by such chance or device, shall be punished by a fine of not more than three thousand dollars or by imprisonment in the state prison for not more than three years, or in jail or the house of correction for not more than two and one half years.   

",False,http://malegislature.gov/api/Chapters/271/Sections/7/,"{'Code': 'IV', 'Details': 'http://malegislature.gov/api/Parts/IV'}"
271,7A,Raffles and bazaars; conduct by certain organizations,"Section 7A. In this section the following words shall have the following meanings:  

''Raffle'', an arrangement for raising money by the sale of tickets, certain among which, as determined by chance after the sale, entitle the holders to prizes.  

''Bazaar'', a place maintained by the sponsoring organization for disposal by means of chance of one or both of the following types of prizes: (1) merchandise, of any value, (2) cash awards, not to exceed $250 each.  

Notwithstanding any other provisions of law, raffles and bazaars may be promoted, operated and conducted under permits issued in accordance with the provisions of this section.  

No organization, society, church or club which conducts a raffle or bazaar under the provisions of this section shall be deemed to have set up and promoted a lottery and nothing in this chapter shall authorize the prosecution, arrest or conviction of any person connected with the operation of any such raffle or bazaar; provided, however, that nothing contained in this section shall be construed as permitting the game commonly known as ''beano'' or any similar game regardless of name.  

No raffle or bazaar shall be promoted, operated or conducted by any person or organization, unless the same is sponsored and conducted exclusively by (a) a veterans' organization chartered by the Congress of the United States or included in clause (12) of section five of chapter forty of the General Laws; (b) a church or religious organization; (c) a fraternal or fraternal benefit society; (d) an educational or charitable organization; (e) a civic or service club or organization; and (f) clubs or organizations organized and operated exclusively for pleasure, recreation and other nonprofit purposes, no part of the net earnings of which inures to the benefit of any member or shareholder. Such organization shall have been organized and actively functioning as a nonprofit organization in the commonwealth for a period of not less than two years before it may apply for a permit. The promotion and operation of the raffle or bazaar shall be confined solely to the qualified members of the sponsoring organization and no such member shall receive remuneration in any form for time or effort devoted to the promotion or operation of such raffle or bazaar. All funds derived from any raffle or bazaar shall be used exclusively for the purposes stated in the application of the sponsoring organization which purposes shall be limited to educational, charitable, religious, fraternal or civic purposes or for veterans' benefits.  An organization which meets the qualifications required by this section and which desires to conduct or operate a raffle or bazaar within the commonwealth shall apply for a permit to conduct raffles and bazaars from the clerk of the city or town in which the raffle will be drawn or the bazaar held. The application form shall be approved by the commissioner of the division of occupational licensure and shall include the name and address of the applicant, the evidence on which the applicant relies in order to qualify under this section, the names of three officers or members of the organization who shall be responsible for the operation of the raffle or bazaar, and the uses to which the net proceeds will be applied. Unless otherwise established in a town by town meeting action and in a city by city council action, and in a town with no town meeting by town council action, by adoption of appropriate by-laws and ordinances to set such fees, a fee of ten dollars shall accompany each such application and shall be retained by the city or town, but in no event shall any such fee be greater than fifty dollars. Upon receipt of such application, the clerk shall determine whether it is in conformity with this section. If the clerk so determines, he shall forward the application to the chief of police of the city or town, who shall determine whether the applicant is qualified to operate raffles and bazaars under this section. If the chief of police so determines, he shall endorse the application and return it to the clerk, who shall forthwith issue a permit, which shall be valid for one year from the date of its issuance. The clerk shall retain a copy of the application and shall send a copy to the commissioner of the division of occupational licensure. If there is any change in the facts set forth in the application for a permit subsequent to the making of such application, the applicant shall forthwith notify the authority granting such permit of such change, and such authority shall issue such permit if the applicant is qualified, or, if a permit has already been issued and the change in the facts set forth in the application disqualify the applicant revoke such permit.  

If an application is not acted upon within thirty days after it is submitted, or if the organization is refused a permit, or if a permit is revoked, any person named on the application may obtain judicial review of such refusal or revocation by filing within ten days of such refusal or revocation or within ten days of the expiration of such thirty day period a petition for review in the district court having jurisdiction in the city or town in which such application was filed. A justice of said court, after a hearing, may direct that such permit be issued, if he is satisfied that there was no reasonable ground for refusing such permit, and that the applicant was not prohibited by law from holding raffles or bazaars.  

An organization issued a permit under this section shall within thirty days of the expiration of its permit submit a report on a form to be approved by the commissioner of the division of occupational licensure. Such form shall require information concerning the number of raffles and bazaars held, the amount of money received, the expenses connected with the raffle or bazaar, the names of the winners of prizes exceeding $250 in value, the net proceeds of the raffles and bazaars, and the uses to which the net proceeds were applied. The organization shall maintain and keep such books and records as may be necessary to substantiate the particulars of such report, which books and records shall be preserved for at least one year from the date of such report and shall be available for inspection. Such report shall be certified to by the three persons designated in the permit application as being responsible for such raffle or bazaar and by an accountant. Two copies of said report shall be filed with city or town clerk. The clerk shall send one copy to the commissioner of the division of occupational licensure. Failure to file said report shall constitute sufficient grounds for refusal to renew a permit to conduct raffles or bazaars. The fee for renewal of such permit shall be ten dollars.  

The authority granting any permit under this section shall immediately revoke the same for a violation of any provision of this section and shall not issue any permit to such permittee within three years from the date of such violation. Any person aggrieved by the action of such authority revoking such permit may appeal to the district court having jurisdiction in the city or town where the permit was issued; provided that such appeal shall be filed in such court within twenty days following receipt of notification by said authority. The court shall hear all pertinent evidence and determine the facts and upon the facts so determined annul such action or make such decision as equity may require. The foregoing remedy shall be exclusive.  

Any organization conducting or operating a raffle or bazaar under this section shall file a return with the state lottery commission, on a form prepared by it, within ten days after the raffle or bazaar is held and shall pay therewith a tax of five per cent of the gross proceeds derived from such raffle or bazaar.  

All sums received by said commission from the tax imposed by this section as taxes, interest thereon, fees, penalties, forfeitures, costs of suits or fines, less all amounts refunded thereon, together with any interest or costs paid on account of such refunds, shall be paid into the treasury of the commonwealth.  

Whoever violates any provision of this section or submits false information on an application or report required under this section shall be punished by a fine of not more than one thousand dollars or by imprisonment in the house of correction for not more than one year, or both.  

No person who prints or produces tickets, cards or any similar article used in the conduct of a bazaar or raffle pursuant to a permit issued under the provisions of this section shall be subject to any penalty therefor, provided that a certified copy of such permit was presented to him prior to his undertaking to print or produce such tickets or cards.  

No organization issued a permit under this section shall conduct more than three bazaars in any single calendar year nor shall such organization conduct more than one bazaar in any single calendar day. The operation of a bazaar shall be limited to five consecutive hours.   

",False,http://malegislature.gov/api/Chapters/271/Sections/7A/,"{'Code': 'IV', 'Details': 'http://malegislature.gov/api/Parts/IV'}"
